headline,summary,datetime,source,url,ticker
"Alcohol Use Disorder Market Report 2025-2035 Featuring Clearmind Medicine, Purdue Pharma, Psyence Biomedical, Eli Lilly and Co, Tempero Bio,, Nxera Pharma, Novo Nordisk, Adial, Alkermes, Lundbeck","The global alcohol use disorder market is experiencing significant growth, driven by increasing demand for innovative and personalized treatments, and the integration of digital health technologies. Advancements in pharmacotherapies and personalized medicine are offering more effective solutions, while telemedicine and online support expand treatment accessibility. Despite challenges like high costs and stigma, especially in developing regions, the market shows potential for further growth. Key",2025-07-09 10:15:00,Yahoo,https://finnhub.io/api/news?id=fed1316f34d0de070150e0b30c25f5bda1c835c19ceb3d892fcd790ae67540ec,LLY
FDA approves updated label for Lilly's Kisunla (donanemab-azbt) with new dosing in early symptomatic Alzheimer's disease,"Eli Lilly and Company (NYSE: LLY) announced today that the U.S. Food and Drug Administration (FDA) has approved a label update with a new recommended titration dosing schedule for Kisunla (donanemab-azbt), Lilly's once-monthly amyloid-targeting therapy for adults with early symptomatic Alzheimer's disease (AD), which includes people with mild cognitive impairment (MCI) as well as people in the mild dementia stage of AD, with confirmed amyloid pathology.1,2 In the TRAILBLAZER-ALZ 6 study, the mod",2025-07-09 10:45:00,Yahoo,https://finnhub.io/api/news?id=a17e883585480be6f5092570abe8c85ac2a4575269855b2f4e365d03af7a917b,LLY
Trump's Drug Tariffs: Where Does the U.S. Import Pharmaceuticals From?,President Trump has threatened to slap a 200% tariff on foreign-made pharmaceuticals. That would roil the $200 billion-plus market for drug imports. Here's a breakdown of which countries—and medicines—could be exposed.,2025-07-09 11:29:40,Yahoo,https://finnhub.io/api/news?id=2b9b9ef493b1fddef093886a32bfd6c24900ca4ffac738467cb34bca5e5a6cc2,LLY
Concentra Group Holdings (CON) Strengthens Board to Accelerate Growth,"Concentra Group Holdings Parent, Inc. (NYSE:CON) is one of the 15 successful spin-off companies. On June 26, the company confirmed the appointment of two new board members as it looks to unlock new growth opportunities and enhance shareholder value. The company confirmed the appointment of Vipin Gopal and Brigid Bonner to its board, effective July […]",2025-07-09 11:34:36,Yahoo,https://finnhub.io/api/news?id=04da149b761d324af8c0b22a756057abe9a6eb1de3863d09368ffd5e8db14d2a,LLY
Verona Pharma Stock Jumps 20% on $10B Buyout Offer From Merck,VRNA jumps 20% after Merck unveils buyout to add COPD drug Ohtuvayre and reduce its reliance on Keytruda.,2025-07-09 13:19:00,Yahoo,https://finnhub.io/api/news?id=16a0ec4ea00adf94ea44aea98aaef434dd1c577df6835043c52dfcfc4f21af13,LLY
Merck Faces Multiple Challenges: Will It Steer Through Successfully?,MRK banks on new launches as Keytruda faces a looming patent cliff and Gardasil weakens amid China's demand slump.,2025-07-09 13:24:00,Yahoo,https://finnhub.io/api/news?id=3913d662aa4220ce980be59df562b1a9635337751fca0692b11b698b88d7d6f9,LLY
Wall Street waves off Trump's 200% pharma tariff threat,"President Trump threatened as much as 200% tariffs on pharma Tuesday. By Wednesday morning, Wall Street had ignored the threat.",2025-07-09 15:41:38,Yahoo,https://finnhub.io/api/news?id=f696d5cb21c2f80d43981b6002d0e6a0abf371941220b1f8f1f952da059a4a90,LLY
Is Novo Nordisk Increasing Dosage to Defend Wegovy's Edge in Obesity?,"NVO submits higher-dose Wegovy to EMA, aiming for greater weight loss and stronger defense against rivals in the obesity market.",2025-07-09 15:48:00,Yahoo,https://finnhub.io/api/news?id=eb7a3324c98ee8e8e5436f5f101d805a510c9194fc419581f4279ec1906e510a,LLY
Eli Lilly (NYSE:LLY) Gains FDA Approval For New Alzheimer's Drug Dosing Schedule,"Eli Lilly (NYSE:LLY) recently received FDA approval for a new dosing schedule of Kisunla, aimed at reducing amyloid-related imaging abnormalities in Alzheimer's treatment. This development comes amid a 3% price increase for the company in the last quarter. Despite these gains, market activity remained relatively flat over this period, reflecting industry-wide trends. Liquidity, investor sentiment toward tech giants, and market influences such as revised U.S. trade policy and Nvidia's market...",2025-07-09 17:35:33,Yahoo,https://finnhub.io/api/news?id=41ab4da7513a60aee07c802b952362083243db019e5f964b1df1b4af4bb1a17d,LLY
Eli Lilly (LLY) Beats Stock Market Upswing: What Investors Need to Know,"In the most recent trading session, Eli Lilly (LLY) closed at $786.92, indicating a +1.19% shift from the previous trading day.",2025-07-09 21:45:03,Yahoo,https://finnhub.io/api/news?id=defcd7e7490655ae8c9fd05d04883ec4dba7afd38a70b56392269ec9b934b77a,LLY
3 Reasons I Bought Novo Nordisk Stock Instead of Eli Lilly,"Novo Nordisk's beaten-down valuation became too attractive to pass up, so I bought the stock earlier this year.  Eli Lilly's GLP-1 drugs may have more potential, but Novo Nordisk is still likely to be a dominant player in the weight loss and diabetes markets.  Eli Lilly (NYSE: LLY) and Novo Nordisk (NYSE: NVO) are two phenomenal growth stocks that investors probably can't go wrong with when investing in for the long term.",2025-07-09 22:16:00,Yahoo,https://finnhub.io/api/news?id=01bba6fb2e39c86c6c5303c70c340d3cd7ff350a779969f83a2d920a29f8e8ed,LLY
Big Pharma on the Clock as 200% Tariffs Loom,Drugmakers could get an 18-month window to boost U.S. factories or face massive import levies,2025-07-10 12:17:04,Yahoo,https://finnhub.io/api/news?id=add84f741fdae839dce4269c6452a18bd86774cd03714c5eee72151d5eddfe2b,LLY
These 2 Medical Stocks Could Beat Earnings: Why They Should Be on Your Radar,Why investors should use the Zacks Earnings ESP tool to help find stocks that are poised to top quarterly earnings estimates.,2025-07-10 13:00:02,Yahoo,https://finnhub.io/api/news?id=e8b0b8795dba0071d21a2197be5d282be8c6387ef0a512f1ddb03ba82297bd13,LLY
Pharma Companies Remain Calm Amid Fresh Tariff Threat by Trump,"Trump revives tariff threats on pharma imports, but industry giants like LLY and JNJ stay unfazed with major U.S. investments underway.",2025-07-10 13:34:00,Yahoo,https://finnhub.io/api/news?id=df287e40eb727c86c9092cf435149978e345a0469131169198519a9fb2846e4e,LLY
"Lilly Down More Than 15% in a Year: Time to Buy, Sell or Hold?","LLY has slid 15.7% over the past year, but surging demand for Mounjaro and Zepbound could revive the stock's momentum.",2025-07-10 14:09:00,Yahoo,https://finnhub.io/api/news?id=d05716436a4aed3c0bdf9f48152557b84e6cd1e6bd0f3ed451ebcd3b8fe51691,LLY
Eli Lilly Comes Out As ADA Winner,Eli Lilly reported impressive data at the recent American Diabetes Association ('ADA') conference. Its robust pipeline will solidify its market dominance for the next 5-7 years. Read more.,2025-07-10 16:31:48,SeekingAlpha,https://finnhub.io/api/news?id=b71f4849eb54996b367f6072dd34788ba1aca254fdff35358faab0e56a11a865,LLY
"Verve Therapeutics, Inc. (VERV): A Bull Case Theory","We came across a bullish thesis on Verve Therapeutics, Inc. on Stock Region Research’s Substack by Stock Region. In this article, we will summarize the bulls’ thesis on VERV. Verve Therapeutics, Inc.’s share was trading at $11.26 as of June 26th. Verve Therapeutics’ stock surged an astounding 75% following Eli Lilly’s $1.3 billion acquisition announcement, signaling a […]",2025-07-10 17:53:38,Yahoo,https://finnhub.io/api/news?id=31ea17e8b42987cd5418e7ec79485d8407250f3966672b0c5ad9169ea1c8a7f6,LLY
Integer Appoints Michael Coyle to Board of Directors,"~ New Director Brings Extensive Medical Device Industry Leadership and Technology Experience to Integer Board ~ PLANO, Texas, July 10, 2025 (GLOBE NEWSWIRE) -- Integer Holdings Corporation (NYSE: ITGR), a leading global medical device contract development and manufacturing organization (CDMO), today announced it has appointed Michael Coyle to its Board of Directors. Coyle brings more than 40 years of leadership in the medical device industry to Integer and joins the Board as a member of the Audi",2025-07-10 20:52:00,Yahoo,https://finnhub.io/api/news?id=fa7883a9a585b4cace7f459ad865b1670038f2ead0b04c7303a23b099c11620e,LLY
Eli Lilly and Co (India) with Association of Physicians of India announces launch of API - Obesity Gurukul - statement,Eli Lilly and Co:* Eli Lilly and Co with Association of Physicians of India announces launch of API - Obesity Gurukul - statement...,2025-07-11 02:42:17,Finnhub,https://finnhub.io/api/news?id=ea87ea163f017f19e5a79a71601f91375f9de099e6b556524c7ed9cb998277e8,LLY
FDRR: Look At FCPI Instead,FDRR focuses on large-cap dividend stocks tied to Treasury yields but has lagged peers like FCPI despite solid dividend growth. Check out why FDRR ETF is a hold.,2025-07-11 07:24:26,SeekingAlpha,https://finnhub.io/api/news?id=387ca8eaad7512d74bc619ea0ab0ede13f23ce7df8ca01ec198d4c3d7200f2de,LLY
"Trump Threatens 200% Pharma Tariffs, But Analyst Says This Stock Is Immune And Expected To 'Benefit' From Levies","Donald Trump&#39;s proposed 200% tariffs can squeeze the profit margins of pharma companies, but LLY is poised to &#34;benefit&#34; except for the rest.",2025-07-11 07:57:43,Benzinga,https://finnhub.io/api/news?id=85e6b758ecaa72d10664f5aefd9fcea5207ac457b2e871e799b96a7b7331ceb7,LLY
Eli Lilly Has Seized the Lead in Anti-Obesity Drugs. Next Up: a Pill.,"The drugmaker has become a clear winner with its weight-loss drugs. Now, with a pill under development, the company should see earnings gains through the end of the decade.",2025-07-11 08:00:00,Yahoo,https://finnhub.io/api/news?id=e6b663a242acdabc7cbd8b56cfe95bc822c6f6a073bcfb8740e38f53b68a8d2c,LLY
"Psoriatic Arthritis Market Report 2025-2035 | Competitive Analysis of AbbVie, UCB, Pfizer, Johnson & Johnson, Eli Lilly and Co, Bristol-Myers Squibb, Affibody, Amgen, Boehringer Ingelheim, Sun Pharma","Psoriatic arthritis is a chronic inflammatory disease linked to psoriasis, characterized by joint inflammation, pain, and swelling. Affecting both men and women, typically between ages 30-50, it's driven by rising autoimmune diseases and emerging biologic treatments like TNF and JAK inhibitors. Key market developments include advances in early diagnosis tools and precision medicine, tailoring treatments to genetic profiles. While growth is challenged by high biologic costs and diagnosis complexi",2025-07-11 08:01:00,Yahoo,https://finnhub.io/api/news?id=6d6c2f9bc2075c0b32e4585440d25a0af4a43c7f00592f693f00f0d680f64571,LLY
Eli Lilly and : Our 2024 Sustainability Report PDF (2024 SustainabilityReport Final),2024 Sustainability Report Table of Contents A Message from Our CEO 3 Sustainability Highlights 4 Our Strategy ...,2025-07-11 09:29:08,Finnhub,https://finnhub.io/api/news?id=93a17b0fa60d4f15378dbd4959ed204eaeba9fb0df0b3bf605e868e59496b6a4,LLY
Novo Nordisk: The Market Doesn't Get It,"Novo Nordisk's pipeline, especially the oral GLP-1 and Alzheimerâs trial, offers significant long-term upside. Click here to read an analysis of NVO stock now.",2025-07-11 10:55:52,SeekingAlpha,https://finnhub.io/api/news?id=0dadeac5ca3a61b4068e062da8213cf35cec9e3882d638456818a2b3832ba73d,LLY
"Terns Pharmaceuticals: A Risky Buy Ahead Of Q4 Obesity, Oncology Catalysts",Terns' late-stage assets target CML & obesity with key data in Q4 2025. Explore their potential in massive markets. Click here to find out why TERN is a Buy.,2025-07-11 11:27:44,SeekingAlpha,https://finnhub.io/api/news?id=368947792f663051618f16e0e68054efbc23a017ccbe307868ab1042f9a00f79,LLY
"CGDV: Buy For Value, Stay For Dividend Growth",,2025-07-11 12:11:44,SeekingAlpha,https://finnhub.io/api/news?id=3f2a29284fda1824e0c2b24d458feb13f80c120646789b96b753521e3c2d6cc5,LLY
Can Mounjaro and Zepbound Drive Another Strong Quarter for Eli Lilly?,"LLY rides high on surging demand for Mounjaro and Zepbound, now nearly half its revenues ahead of Q2 earnings.",2025-07-11 12:54:00,Yahoo,https://finnhub.io/api/news?id=320c0f9f2903b2b864714b44b388f8800802721fef30a616bb68e616eb35ca08,LLY
Wall Street Bets Big on Eli Lilly: New Drugs Could Drive 300% EPS Growth,"Eli Lilly Surges Ahead: JPMorgan Sees $1,100 Price Target on Obesity Drug Boom",2025-07-11 19:52:56,Yahoo,https://finnhub.io/api/news?id=70789419bc3c84dc763db0d47244f564195fdf089100efac92bab14aad4c5362,LLY
Big pharma's multiple looming patent cliffs: What to know,"The pharmaceutical industry is staring down a major patent cliff, with key drugs from Merck (MRK), Bristol Myers Squibb (BMY), and Johnson & Johnson (JNJ) set to lose exclusivity by 2030. Yahoo Finance Senior Reporter Anjalee Khemlani and Freedom Capital Markets chief global strategist Jay Woods join Market Domination host Josh Lipton to discuss the industry's risks and how Wall Street is responding. To watch more expert insights and analysis on the latest market action, check out more Market Domination here.",2025-07-11 20:56:06,Yahoo,https://finnhub.io/api/news?id=6c19949832175d329a0625c8a4547b90492148f57fabbb3a53416d99530dda68,LLY
"FDA willing to trade faster drug reviews for lower prices, Bloomberg reports","FDA Commissioner Marty Makary said the agency may fast-track new drugs from pharmaceutical companies that “equalize” the cost of their medicines between the U.S. and other countries, Bloomberg’s Rachel Cohrs Zhang and Sam Hornblower report. Makary said in an interview on Bloomberg Television’s Wall Street Week with David Westin that companies that promise to equalize prices can receive a “national priority review voucher,” which would cut review times to one to two months. The vouchers are part",2025-07-12 13:36:03,Yahoo,https://finnhub.io/api/news?id=39b4cc4c3158480c55ef9d63519eb50223d32ca48c2b944773b35b04bc2e6f03,LLY
"Eli Lilly and Company (LLY): I Would “Love” If Trump Praised The Company, Says Jim Cramer","We recently published 14 Stocks Jim Cramer Discussed As He Talked About Record Bitcoin Price. Eli Lilly and Company (NYSE:LLY) is one of the stocks Jim Cramer recently discussed. Eli Lilly and Company (NYSE:LLY) is one of the most frequently discussed pharmaceutical stocks on Cramer’s morning show. Over the course of this year, the CNBC […]",2025-07-12 18:33:01,Yahoo,https://finnhub.io/api/news?id=b37d97ff9d97e7bd4135b81a6d6391cc24380a9ac90990120bf5034d2b409ecd,LLY
"Novo Nordisk A/S (NVO): “Canada’s A Backdoor,” Says Jim Cramer",We recently published 14 Stocks Jim Cramer Discussed As He Talked About Record Bitcoin Price. Novo Nordisk A/S (NYSE:NVO) is one of the stocks Jim Cramer recently discussed. Novo Nordisk A/S (NYSE:NVO) is a Danish pharmaceutical company that was one of the earliest movers in the weight loss drug market. The shares have lost 21% […],2025-07-12 18:33:22,Yahoo,https://finnhub.io/api/news?id=cdce5107db73a468c7cc5b5bde1a49876487cb477f5ff28428d5379577c332da,LLY
Why Novartis Is Still A 'Buy' After 15% Surge,"Novartis shares climb on strong Cosentyx sales, franchise growth, and a new malaria drug approval despite political risks. Find out why NVS stock is a buy.",2025-07-13 10:45:00,SeekingAlpha,https://finnhub.io/api/news?id=ed6b3e9c41c0c4097ff67891dd2e8c7caf7cf443c0fb78ffe110c1c84137ab35,LLY
Trump Says 200% Pharma Tariffs Are Coming. Wall Street Shrugs.,A generous grace period would give drugmakers time to sidestep most of the pain of looming duties.,2025-07-13 11:01:00,Yahoo,https://finnhub.io/api/news?id=ec6b84b673d39f1e4600d814b13960f4d557f79639884661936bf748ab16fce4,LLY
Biotech Stocks Are Ready to Rebound. 3 to Watch Now.,"Long-suffering biotech investors might be in for a treat as the SPDR S&P Biotech exchange begins to show signs of renewed strength.  Large pharmaceutical companies, facing thinning pipelines, are aggressively acquiring cutting-edge biotech firms.  Notable billion-dollar deals in the past two months include the acquisition of  Verona Pharma  by Merck,  Sanofi’s   buyout of  Blueprint Medicines  and  Eli Lilly’s   purchase of  Verve Therapeutics  In a significant technical move, the ETF has recently broken out above an eight-month trend of lower highs—an important shift dating back to the start of the current administration.",2025-07-14 05:30:00,Yahoo,https://finnhub.io/api/news?id=d921a7ea8f49b289f453f7c87799f0b573d2ce2df7c042968a8fea9c39cf3e8d,LLY
"This Is 'One Of The Hottest Stocks In The Universe,' Jim Cramer Says","Rocket Lab notched its fastest launch turnaround ever, completing its 68th Electron mission and signaling a new era of rocket deployment.",2025-07-14 08:49:39,Benzinga,https://finnhub.io/api/news?id=89ae655fceea01e562cd784db96585c3aa834bb5312575ef71c3af9cbaffa459,LLY
Biotech Stocks Are Ready to Rebound. Gilead Sciences and 2 More to Watch Now.,Biotech Stocks Are Ready to Rebound. Gilead Sciences and 2 More to Watch Now.,2025-07-14 08:51:00,MarketWatch,https://finnhub.io/api/news?id=af2aafb0cf42b97bac23331ec68d797ee9e274d8927b39712211af92d4fdb47c,LLY
IYH: An Aggressive Positioning On The U.S. Healthcare Industry,,2025-07-14 09:44:55,SeekingAlpha,https://finnhub.io/api/news?id=340f45607bb5065e194dbc14f156d63272ffd4058d421fa9dc9e738b185f06ca,LLY
Obesity Drug Pipeline Analysis Report 2025 | Pfizer and Eli Lilly Lead the Charge in Cutting-Edge Obesity Research,"In 2022, over 1 billion people were affected by obesity, driving innovation in therapeutic advancements. Emerging treatments focus on appetite control and metabolic pathways, with pharmaceutical support bolstering development. The 2025 Obesity Drug Pipeline Report offers insights into recent breakthroughs, clinical trials, and regulatory trends, highlighting the shift toward personalized therapies and novel drug classes like peptides and RNA-based treatments. Key players include Pfizer and Eli L",2025-07-14 09:46:00,Yahoo,https://finnhub.io/api/news?id=bf831dc0f077513f8d51e1e3b36151a67ad12aa03ca98defb9b11525ad47eca5,LLY
How To Trade This 150% Gainer Chasing A Cure For Type 1 Diabetes,"An update on Sana Biotechnology. 

",2025-07-14 09:54:26,Benzinga,https://finnhub.io/api/news?id=716deb6803e3c8e2064383f6d629f347d6bf223c90c9d2117802b77f4d7f58f3,LLY
GLP-1 Agonists Drug Pipeline Analysis Market Report 2025 | Next-generation GLP-1 Agonists Pave the Way for Diabetes and Obesity Management,"Explore the growing GLP-1 agonists market, driven by rising diabetes and obesity rates. Discover advancements in therapies like Tirzepatide and GZR18, offering both glycemic control and weight loss benefits. Key players such as Eli Lilly innovate, contributing to market expansion and investment in metabolic health.Dublin, July 14, 2025 (GLOBE NEWSWIRE) -- The ""GLP-1 Agonists Drug Pipeline Analysis Report 2025"" drug pipelines has been added to ResearchAndMarkets.com's offering.The GLP-1 Agonists",2025-07-14 09:56:00,Yahoo,https://finnhub.io/api/news?id=95aa4007db5aa1240f6bd4bfa2e3d5bbdcf9d73a2147c7851317e69a717d05d7,LLY
"Europe Glucagon-like Peptide-1 (GLP-1) Agonists Research Report 2025 | Market to Reach $14.34 Billion by 2034, Driven by Innovative R&D, Strategic Collaborations, and Drug Formulation Advancements","The Europe GLP-1 agonists market, valued at USD 7.09 billion in 2024, is set to grow at a 17.30% CAGR, reaching USD 14.34 billion by 2034. Driven by rising diabetes and obesity rates, innovative drug formulations, and supportive healthcare policies, the market is expanding. Key players include Eli Lilly, Sanofi, and Novo Nordisk. Challenges involve high costs and regulatory complexities. Opportunities lie in obesity treatment expansion and advanced drug delivery systems. European Glucagon-like P",2025-07-14 10:04:00,Yahoo,https://finnhub.io/api/news?id=01058650ccd72bef4d66fdf57aa8a5d3248643ea3ea5f5a8ec1d0fc4de9e122c,LLY
"AnaptysBio: Potential Promise, But Some Cause For Skepticism","AnaptysBioâs lead drug rosnilimab showed promise in RA, but lack of a Phase 3 plan and limited pipeline raise concerns. Find out why ANAB stock is a hold.",2025-07-14 10:46:51,SeekingAlpha,https://finnhub.io/api/news?id=a8f2a499ca9319c5d73cf6d5524bcd8a35a420e9b32cb33fb26f779c2f4e0f05,LLY
Investors Heavily Search Eli Lilly and Company (LLY): Here is What You Need to Know,"Lilly (LLY) has received quite a bit of attention from Zacks.com users lately. Therefore, it is wise to be aware of the facts that can impact the stock's prospects.",2025-07-14 13:00:04,Yahoo,https://finnhub.io/api/news?id=bf329dc58e449d9b8210b6b7d9c778bbae3bd3dc9e0bfe194f72652dc590cba2,LLY
"ProKidney Just Set a New 52-Week High. Should You Buy, Sell, or Hold PROK Stock Here?","As ProKidney hits a fresh 52-week high, can it sustain momentum through late-stage trials, or should investors stay cautious amid the market’s mixed view?",2025-07-14 13:45:02,Yahoo,https://finnhub.io/api/news?id=6ca13cd68f8220dd4357c2a93345c943c747720ae613712cda63f8c900c22b36,LLY
MRK's Buyout Spree to Broaden Product Portfolio: Can it Aid Growth?,Merck's impending Verona buyout and recent biotech deals aim to expand its pipeline and cut reliance on Keytruda sales.,2025-07-14 14:23:00,Yahoo,https://finnhub.io/api/news?id=5ed0b77d6dc0a36658d38ba6207ff63d9f666a1de0898608b6a6d180ab9cc564,LLY
WW International: Menopause Health's Comeback,"WW International relists on Nasdaq, pivoting to menopause care with GLP-1 drugs and coaching. Click here to read an analysis of WW stock now.",2025-07-14 14:59:32,SeekingAlpha,https://finnhub.io/api/news?id=bb97a59c0c40d59ede7db26534a002c84e3aaccbf3590b11b618c7fb0703d86c,LLY
Illimis secures funding for GAIA-based Alzheimer’s therapeutics,The company plans to utilise the funds to extend its research into immune disorders.,2025-07-14 15:22:58,Yahoo,https://finnhub.io/api/news?id=659e936c8bedf23240b351c85e7aa83d42bccce5fb3ab233d15f27269f463961,LLY
"Top Research Reports for Eli Lilly, Netflix & GE Aerospace","LLY, NFLX, and GE lead today's top stock picks, with strong growth drivers but face headwinds from pricing, rivals, and costs.",2025-07-14 20:35:00,Yahoo,https://finnhub.io/api/news?id=58b6aac6ca314dd0b51883447506ef092542ecc44a514862f7843700de8d81e9,LLY
Parnassus Core Select ETF Q2 2025 Commentary,,2025-07-15 06:54:00,SeekingAlpha,https://finnhub.io/api/news?id=b11e555843406bfb556368f689c60a477ec9e713f72e0167ce56ad0cf338eed3,LLY
Kailera touts late-stage win for weight-loss drug in China,U.S.-based Kailera Therapeutics andChinese firm Jiangsu Hengrui Pharmaceuticals'experimental weight-loss drug has helped overweight patientslose up to 17.7% of body weight in a late-stage study in...,2025-07-15 07:31:19,Finnhub,https://finnhub.io/api/news?id=63d334cd2999b244a64d4493f7a04ba77d7b5ca8e9c3aa95d17724ab81da4605,LLY
Amgen: Great Starting Yield For This Wealth Compounder,"Amgen combines patent protection, a robust pipeline, and strong execution for defensive investment.",2025-07-15 08:00:00,SeekingAlpha,https://finnhub.io/api/news?id=43424ea61b871b3eb0aef6fd5619c80550422fec595c0c4b232b73874992cca5,LLY
Parnassus Growth Equity Fund Q2 2025 Commentary,"Parnassus Growth Equity Fund (Investor Shares) returned 18.97% (net of fees) during the quarter, outperforming the Russell 1000 Growth Indexâs 17.84%. Read more here.",2025-07-15 08:22:00,SeekingAlpha,https://finnhub.io/api/news?id=76cb4babf97141731cff29a2d4e1fa66167489bdd2866cdffbd4540e8483e33e,LLY
Eli Lilly: Still Too Pricey To Buy,"Eli Lilly's weight loss drugs boost revenue, but high valuation limits upside. Explore their GLP-1 success, pipeline potential, and investment outlook.",2025-07-15 11:15:54,SeekingAlpha,https://finnhub.io/api/news?id=05d729e083f64accb3840aebcae273ce8576afc8168e7315817efbc3122de4aa,LLY
Health Canada Approves Lilly's Omvoh® (mirikizumab) for Crohn's Disease; New Citrate-Free Formulation,"Eli Lilly Canada Inc. (Lilly Canada) announced today that Health Canada has approved Omvoh® (mirikizumab) for CD, which will soon be available to patients in Canada. Omvoh® is an interleukin-23p19 antagonist for the treatment of adult patients with moderately to severely active CD who have had an inadequate response, loss of response, or were intolerant to either conventional therapy or a biologic treatment.1 Health Canada has also approved a new citrate-free formulation of Omvoh® for subcutaneo",2025-07-15 12:30:00,Yahoo,https://finnhub.io/api/news?id=d0fcdf35f9570a97ddce5bf8c409751d9b6d1285c40edaeefabec8f8db9a8310,LLY
Novo Nordisk Plunges 20% YTD: How Should Investors Play the Stock?,"NVO shares fall 19.9% year to date amid weak CagriSema data, CEO exit and rising pressure from rivals in obesity care.",2025-07-15 12:34:00,Yahoo,https://finnhub.io/api/news?id=5601753e6705c84146473dc1f83434e4b9cbffe179037df81ac46c3a8241cc62,LLY
Here's How to Play AbbVie Stock as it Reaches Golden Cross,"ABBV hits a bullish golden cross as Skyrizi and Rinvoq drive growth, offsetting Humira losses and aesthetic headwinds.",2025-07-15 12:35:00,Yahoo,https://finnhub.io/api/news?id=f28b77868975c7f132bae34484b78583d0475940bc899f3b8a32f85e5e957415,LLY
Eli Lilly (LLY) Secures FDA Label Update for Alzheimer’s Disease Treatment,"Eli Lilly and Company (NYSE:LLY) is one of Goldman Sachs’ top healthcare stock picks. On July 9, the company confirmed the approval by the US Food and Drug Administration of a label update for its once-monthly amyloid-targeting therapy for adults with early symptomatic Alzheimer’s disease (AD). The new label significantly reduces the incidence of amyloid-related […]",2025-07-15 13:10:24,Yahoo,https://finnhub.io/api/news?id=0737c8014f18bb08e95939aa4ceb5f80033b7cbca48f81ad708becfe2bee517a,LLY
10 Health Care Stocks Whale Activity In Today's Session, ,2025-07-15 13:35:24,Benzinga,https://finnhub.io/api/news?id=36de3bb6154fe71ef9072ba19a7389c0d1102d6adb965634131b3df5bfa5da11,LLY
