headline,summary,datetime,source,url,ticker
"These Stocks Are Today’s Movers: Novo Nordisk, Eli Lilly, Paramount, Nvidia, and More","Nvidia shares tick up as investors await the chip maker’s fourth-quarter earnings, which likely will reveal how artificial-intelligence demand is holding up.",2026-02-23 10:58:00,Yahoo,https://finnhub.io/api/news?id=f2d45ebd58981cdd9aca2dc6ac177befa6b34ed2aa63fe10258935fac4a4624b,LLY
Eli Lilly Unusual Options Activity For February 23, ,2026-02-23 11:01:07,Benzinga,https://finnhub.io/api/news?id=a3f46e003c730966ed4d497fc0406fbeb86638a5dd815a4a3140c7c0f0dbaf4c,LLY
Novo Nordisk Shares Plunge After Obesity Drug Fails to Beat Rival in Trial,Shares fell sharply after the Danish drugmaker said its CagriSema experimental obesity drug failed to beat the weight loss delivered by Eli Lilly’s Zepbound in a head-to-head clinical trial.,2026-02-23 11:07:00,Yahoo,https://finnhub.io/api/news?id=83c8748534487adb63808f73e568fa98acf543a036be6a862537b08dfdc17826,LLY
"Social Buzz: Wallstreetbets Stocks Mostly Lower Premarket Monday; Novo Nordisk, Strategy to Decline",The most-talked-about stocks in the Reddit subforum Wallstreetbets were mostly lower hours before Mo,2026-02-23 11:36:37,Yahoo,https://finnhub.io/api/news?id=3572172d85a80beaf852660194513d93bb9b9f18a5a81780a14d90e2fde9d5db,LLY
"Novo Nordisk Weight-Loss Drug Less Effective Than Eli Lilly's, Trial Data Shows",Novo Nordisk (NVO) US-listed shares fell early Monday after the latest trial results of the Danish p,2026-02-23 11:36:50,Yahoo,https://finnhub.io/api/news?id=66bddb7218c30fe55a49120aabbb5d13659a0de975a813cb133181bf1d9ffec8,LLY
Novo Nordisk's CagriSema trial deals a blow in obesity drug rivalry with Eli Lilly,"COPENHAGEN, Feb 23 () - Novo Nordisk's next-generation obesity drug CagriSema was less effective than Eli Lilly's tirzepatide in a head-to-head trial, the Danish drugmaker said on Monday, in a setback to its ‌efforts to dominate the weight-loss market. Novo Nordisk is fighting to regain first-mover advantage in the obesity ‌treatment market, where demand for drugs with higher efficacy has surged.",2026-02-23 11:41:55,Yahoo,https://finnhub.io/api/news?id=4b35f31720bf0fd90f277f23cef7b953eb1f3fadb68532a14eb68a1f7d6bdcc9,LLY
Novo Nordisk Shares Plunge After Obesity Drug Fails to Beat Zepbound,Novo Nordisk Shares Plunge After Obesity Drug Fails to Beat Zepbound,2026-02-23 11:44:00,DowJones,https://finnhub.io/api/news?id=d0aae4a202ae08dc68a7886c17d177e88f67fefd5d16a572934f7b3bdb0c5f7f,LLY
Novo Nordisk Stock Plunges and Eli Lilly Jumps. It’s All Down to This Weight-Loss Drug Trial.,Novo shares slump after the Danish drugmaker’s experimental obesity drug fails to beat Lilly’s treatment in an 84-week trial.,2026-02-23 12:17:00,Yahoo,https://finnhub.io/api/news?id=0f383570c023049649c209c6843030dbdc46cb6406f25ee8918fe63eae54cc6e,LLY
Stocks Down Pre-Bell as Trump Raises Global Tariffs Following Supreme Court Ruling,The benchmark US stock measures were tracking in the red before the opening bell Monday as President,2026-02-23 12:35:16,Yahoo,https://finnhub.io/api/news?id=41f0d909132c61a9c64972c7a016cf90be2bb65250e557a211873bca7593cf84,LLY
Novo Nordisk Tumbles in 'Worst Case Scenario': Next-Gen Weight Loss Drug Underperforms,"Novo Nordisk stock, once the darling of the pharmaceutical world, tumbled as investors reacted to a &#34;worst-case scenario.&#34; ",2026-02-23 12:35:26,Benzinga,https://finnhub.io/api/news?id=8ce9761c156127ec42b7ba19922edcffff9494fa089f77b55e20210c26fc8502,LLY
1 Reason I'm Seriously Considering Novo Nordisk as a Buy‑and‑Never‑Sell Obesity Stock,Novo Nordisk investors get a second bite at the Ozempic apple.,2026-02-23 12:38:00,Yahoo,https://finnhub.io/api/news?id=173daf2a8d6b25aabb3a8938085f5fba8199fb83a0917cb2de67d21028654c06,LLY
Novo Nordisk flags board members for re-election amid restructuring efforts,"Three new board and shareholder-elected members could join Novo’s council, which largely consists of recent appointees following a restructure in October 2025.",2026-02-23 12:39:06,Yahoo,https://finnhub.io/api/news?id=9f444a47f3497c656bb8f50ad9041a0d4d51f4a7843481806f54a26694e67c0f,LLY
"Hedge Funds' Mag 7, Eli Lilly Buying Spree Sparks Massive ETF Accumulation In IVV, SPY, QQQ","Hedge funds bet heavily on big tech, Eli Lilly, and others in Q4, driving flows into SPY, QQQ, as mega-cap stocks dominated portfolio allocations.",2026-02-23 12:51:12,Benzinga,https://finnhub.io/api/news?id=ed31a5b9a5240dab18100c3c2179ad5b800f1ef5932f0433a620b2544af8cded,LLY
"Fancy clothes, mealtime alarms and Disney princess gigs: How GLP-1s are changing people's lives in unexpected ways",GLP-1 drugs for weight loss are growing in popularity in the U.S. and across the world. Here's what some users say about their experiences with the medicines.,2026-02-23 13:04:05,CNBC,https://finnhub.io/api/news?id=20ebee7890312d68d66af04aca400e420818c074b46e540aaa6aaf78b168aebf,LLY
"Novo Nordisk's next obesity drug falls short of Lilly rival, wiping billions off its market value","Novo Nordisk (NYSE:NVO) attempt to reclaim the initiative in the obesity drug race has backfired, after its experimental next-generation treatment failed to prove it was as effective as a rival therapy from Eli Lilly. The Danish drugmaker's shares were off 14% ahead of the bell in the US (it...",2026-02-23 13:09:00,Yahoo,https://finnhub.io/api/news?id=baafe29677bdfb86fccd6a639bcbb4fdd218b474809d6e6ae59a93c468e15a79,LLY
5 Things to Know Before the Stock Market Opens,"News of the day for Feb. 23, 2026",2026-02-23 13:11:53,Yahoo,https://finnhub.io/api/news?id=a461de889e5a63cb8a88b7feb9bcd0739ba647c0506511cea6537ee4539a525f,LLY
Novo Nordisk Dives As Next-Gen Obesity Drug Fails To Match Eli Lilly's Zepbound,Novo Nordisk stock dived after Novo's next-generation obesity drug CagriSema didn't match weight loss from Eli Lilly's Zepbound. Lilly stock rose.,2026-02-23 13:23:06,Yahoo,https://finnhub.io/api/news?id=6c3c9d591f4c2b469215de6cc1e926ceea4ec358dfbbd070e8635b6e5329e23d,LLY
Wondering what's happening in today's S&P500  pre-market session?,"Before the opening bell on Monday, let's take a glimpse of the US markets and explore the S&P500 top gainers and losers in today's pre-market session.",2026-02-23 13:35:03,ChartMill,https://finnhub.io/api/news?id=3f840ce7108ef9f835ffd08252979c3654166f97d13ea9b3443d286aaf78cb59,LLY
Novo Nordisk's CagriSema falls short against Eli Lilly's in trial,"STORY: In a head-to-head trial, Novo Nordisk said its next-generation obesity drug CagriSema was less effective than Eli Lilly's tirzepatide.It's a setback for the firm in the race for dominance in the weight-loss drug market.The trial was designed to show CagriSema was at least as effective as tirzepatide in reducing weight.But Novo Nordisk said in a statement that it failed to meet that goal.Its share price fell as much as  11% by mid-morning trade on Monday.The results mean Novo's next-generation treatment delivered less weight loss than Eli Lilly's drug, which is already on the market under the brand name Zepbound and Mounjaro.Novo Nordisk said additional trials are exploring the full weight loss potential of CagriSema.And include higher-dose combinations.Eli Lilly shares rose 4% in U.S. premarket trading.",2026-02-23 13:41:13,Yahoo,https://finnhub.io/api/news?id=21f036e00b07542fafc7df576ad6b8113336da9b905620461fe9b635852b7959,LLY
"Zepbound (tirzepatide), the most prescribed weight management medication in 2025, now available in multi-dose KwikPen","Eli Lilly and Company (NYSE: LLY) today announced the U.S. Food and Drug Administration (FDA) approved a label expansion for Zepbound® (tirzepatide) to include the four-dose single-patient use KwikPen® that delivers a full month of treatment in one device. With the Zepbound KwikPen, Lilly is expanding choice and helping ensure patients and healthcare providers can select the option that best fits individual needs, preferences, and circumstances. Patients, with a valid prescription, opting for se",2026-02-23 14:00:00,Yahoo,https://finnhub.io/api/news?id=015e0796be9a45019657daa557bdad182c589ad49e08132ae5c50d6606d0d133,LLY
Lilly to launch multi-dose weight-loss drug device in US,"Feb 23 () - Eli Lilly said on Monday it received the U. Food and ‌Drug Administration's approval to launch a ‌four-dose KwikPen for its weight-loss drug Zepbound, delivering a ​full month of the treatment in a single device.",2026-02-23 14:03:58,Yahoo,https://finnhub.io/api/news?id=7258120a95acdaa3dcf78becbb54c3d205cef223331d2c78a68e0d1e14c2e115,LLY
Weight-loss drug trial results wipe £147bn off Ozempic maker,Almost £150bn has been wiped off Ozempic drugmaker Novo Nordisk after a trial of its new weight-loss drug fell short of expectations.,2026-02-23 14:11:08,Yahoo,https://finnhub.io/api/news?id=90f71bedc29d7f40fdb9300cc3a5c841f039ebae17c8b0026ecfe92cde614f7f,LLY
"Instant View: Novo's CagriSema setback may shift investor focus to M&A strategy, analysts say","Feb 23 () - Novo Nordisk's next-generation weight-loss drug CagriSema was less effective than Eli Lilly's Zepbound in a head-to-head trial, a fresh blow to the Danish drugmaker's efforts to reclaim its early lead in the booming ‌obesity drug market. Below are some reactions from analysts.",2026-02-23 14:30:58,Yahoo,https://finnhub.io/api/news?id=352287980173607e7be9ea7ef22d8a78d380cf31ab5709605a02fad2427ecbcb,LLY
Why Novo Nordisk Stock Is Pluging—and Why It’s Good News for Lilly,Novo shares slump after the Danish drugmaker’s experimental obesity drug fails to beat Lilly’s treatment in an 84-week trial.,2026-02-23 14:36:00,Yahoo,https://finnhub.io/api/news?id=097673b0174e7d82c684da4b324c59a3c6402f665ee9329db1e2922afda13843,LLY
"Eli Lilly has already won the weight loss drug battle, says Mizuho's Jared Holz","Sarat Sethi, DCLA, and Jared Holz, Mizuho health care sector strategist, join 'Power Lunch' to discuss Holz thoughts on the weight loss drug 'war'.",2026-02-23 14:39:03,CNBC,https://finnhub.io/api/news?id=272606b1d6fcd4c040446d84dfaeed62ad7b8d6454d16ccb8b1e6bc334b53f66,LLY
"Stocks to Watch Monday: Novo Nordisk, Merck, Domino's, Gilead","? Merck (MRK): The drugmaker is splitting its pharmaceuticals unit to bolster product launches before a crucial patent loss. One will house its cancer drugs, including blockbuster Keytruda. ↘️ Novo Nordisk (NVO), (DK:NOVO.",2026-02-23 14:41:07,Yahoo,https://finnhub.io/api/news?id=6adc7ab400ce9225ffacd064418fc9532cca6d1c1c3066289ae6b99aad5741eb,LLY
"Zacks Market Edge Highlights: MasTec, Caterpillar, Walmart, Eli Lilly and Howmet Aerospace","MasTec, Caterpillar, Walmart, Eli Lilly and Howmet Aerospace hit 5-year highs as double-digit 2026 earnings growth fuels a new ""Magnificent"" list.",2026-02-23 14:46:00,Yahoo,https://finnhub.io/api/news?id=68a4fdafcdf082621b911980658ebe53089bab38e9302f5855d26bd6a395a315,LLY
Nasdaq and Dow Jones set to start week lower as Trump resets tariffs,"10am: Dow Jones leads retreat at open US stocks have opened in the red, as expected. The Dow Jones is at the front of the retreat, down 0.9%, with the Nasdaq down 0.6% and the S&P 500 falling 0.45% Biggest faller on the Dow is Salesforce, down 4.4%, followed by Nike, down 3.6%, and...",2026-02-23 15:00:00,Yahoo,https://finnhub.io/api/news?id=ce3a18813fb7a57de212e6489b7598746fbe5a5f0e64e572f1e3332f03590070,LLY
Why Novo Nordisk Stock Is Plunging—and Why It’s Good News for Eli Lilly,Why Novo Nordisk Stock Is Plunging—and Why It’s Good News for Eli Lilly,2026-02-23 15:32:00,MarketWatch,https://finnhub.io/api/news?id=69d58b6e3b942e41f6cab9bf9a7b0f389a4040f958b4f9d77fa34c7ee88b0a3f,LLY
Eli Lilly: The Weight‑Loss and Diabetes Powerhouse I'd Hold Through Any Market Crash,The stock looks unstoppable.,2026-02-23 15:50:00,Yahoo,https://finnhub.io/api/news?id=3b3cde3892de8863e0843fa1b591485dc7890306be6bbbae9554f4ccee12cf4b,LLY
Why Novo Nordisk Stock Just Crashed,GLP-1 weight loss drug CagriSema may not be the salvation Novo Nordisk was hoping for.,2026-02-23 15:51:24,Yahoo,https://finnhub.io/api/news?id=19710ae69ed724b58c93d57a353a35c373d8a2fdd0b37f87cc8d35985a6c78b5,LLY
Novo Nordisk Stock Tumbles Monday to Its Lowest Point in Nearly 5 Years. Here's Why,Novo Nordisk shares plunged Monday after the Ozempic and Wegovy maker's newest drug trial results came in short of expectations.,2026-02-23 16:08:28,Yahoo,https://finnhub.io/api/news?id=d7321ebd3bc8d085782fc3d26cf3a1cf1da89d7ad3aea6a8e16ea0c37d0c1780,LLY
"Novo Nordisk Sinks, Lilly Surges After Obesity Drug Trial Shock",Novo Nordisk Stock Slides After CagriSema Disappoints in Late-Stage Study,2026-02-23 16:10:51,Yahoo,https://finnhub.io/api/news?id=a2df9c2196493f4c9633a75ba60b64d4dbedfaad87b860c3e1f3fbce503a5c1a,LLY
Novo Nordisk Dives As Next-Gen Obesity Drug Lags Eli Lilly's Kingpin,Novo Nordisk Dives As Next-Gen Obesity Drug Lags Eli Lilly's Kingpin,2026-02-23 16:11:42,DowJones,https://finnhub.io/api/news?id=e1d9e3786e3ec05c0b1ecdb03711f977ba64f2192037b21543e6a5c93910daf2,LLY
"Trump puts pressure on Netflix board, Domino's stock rises on Q4","Yahoo Finance Senior Reporter Brooke DiPalma tracks several of the day's top trending stock tickers, including Variety reporting that Paramount Skydance (PSKY) plans to up its bid for Warner Bros. Discovery (WBD) while President Trump puts pressure on Netflix (NFLX) to fire his former US ambassador and national security advisor, Susan Rice, from the streaming giant's board. Novo Nordisk (NVO) stock is falling on Monday after its weight-loss drug underperformed compared to Eli Lilly's own GLP-1 in a clinical trial. And, Domino's Pizza (DPZ) shares getting a lift higher when the chain topped fourth quarter revenue estimates. To watch more expert insights and analysis on the latest market action, check out more Market Catalysts.",2026-02-23 16:15:21,Yahoo,https://finnhub.io/api/news?id=577f8c5de9ce7b745e487416a064c7945d54d02985897b91e7cd9ecc2094324d,LLY
Why Eli Lilly Stock Just Popped,Eli Lilly has some good news for investors today. Novo Nordisk has some bad news (which is also good news for Lilly).,2026-02-23 16:15:40,Yahoo,https://finnhub.io/api/news?id=acb4ebedf880f134e9c333debf0cbba94bde8bb6e6407e5d6030d003d6824098,LLY
"Top Midday Stories: Novo Obesity Drug Doesn't Meet Primary Endpoint, Stock Falls; Gilead to Acquire Arcellx for $7.8 Billion","All three major US stock indexes were down in late-morning trading Monday, as investors weigh the co",2026-02-23 16:16:00,Yahoo,https://finnhub.io/api/news?id=e4d61d0d6adf7fd1318d9b4fde5ed228d1d0339d823c6afdf9bc2c1a19fab8a6,LLY
"These Stocks Are Today’s Movers: Novo Nordisk, Lilly, PayPal, Arcellx, CrowdStrike, KKR, Strategy, and More","These Stocks Are Today’s Movers: Novo Nordisk, Lilly, PayPal, Arcellx, CrowdStrike, KKR, Strategy, and More",2026-02-23 16:27:00,MarketWatch,https://finnhub.io/api/news?id=3aa23ebe57bf3bae28b64725f6bd7529bfdacc4598279777c722049bef9f702c,LLY
Novo Nordisk's $475-billion rise and fall as Wegovy-era gains wiped out,"Feb 23 () - Novo Nordisk shares slumped by more than 16% on Monday, wiping away the remaining ‌gains brought by its blockbuster weight-loss drug Wegovy, ‌after the drugmaker said its next-generation obesity drug CagriSema underperformed Eli Lilly's ​rival. Novo, which in 2024 was worth more than $650 billion, has since shed around $475 billion, with the shares back at levels last seen before Wegovy transformed it into Europe's most ‌valuable drugmaker.",2026-02-23 16:55:09,Yahoo,https://finnhub.io/api/news?id=a3df8d60bf38b7ed48981c85db906aaecd7b0271b48276f3ea24098a151639d2,LLY
Novo Nordisk’s stock closes at 4-year low after its next-gen weight-loss drug lost to Lilly’s in Phase 3 trial,Novo Nordisk’s stock closes at 4-year low after its next-gen weight-loss drug lost to Lilly’s in Phase 3 trial,2026-02-23 16:59:00,MarketWatch,https://finnhub.io/api/news?id=b095c6e5106a5bedd5124e1129202cfd2ffc25c970d783eea628828883c73dd6,LLY
Eli Lilly’s Zepbound Gets FDA OK for Multi-Dose Pen,The company said the weight-loss drug will be available at the same self-pay price in either the single-dose vial format or the multi-dose pen that delivers four weekly injections from a single device.,2026-02-23 17:06:00,Yahoo,https://finnhub.io/api/news?id=5f78303097e14097d6f18b8b03e47e035fc56d2f5cfe6af608136f9d81a943d5,LLY
"Health Care Up on Defensive Bias, Even as Novo Nordisk Falls -- Health Care Roundup","Health Care Up on Defensive Bias, Even as Novo Nordisk Falls -- Health Care Roundup",2026-02-23 17:24:00,MarketWatch,https://finnhub.io/api/news?id=b0db9c749f4d5df3911052f33c3f0e664e64dca2b31b5fc1c863126eb1ef511a,LLY
Novo Next-Generation Obesity Shot Falls Short of Lilly Rival,"Novo Nordisk's next-generation obesity shot delivered less weight loss than Eli Lilly rival blockbuster in yet another blow to the Danish company's attempts to regain lost ground in the weight-loss market. People treated with a standard dose of Novo's CagriSema in a trial achieved 20.2% weight loss after 84 weeks, compared with 23.6% for Lilly's tirzepatide. Sam Fazeli of Bloomberg Intelligence joins to discuss. He also breaks down how Merck is splitting its main pharmaceutical unit in two in an effort to better highlight the parts of the business that are growing, as it stares down a patent cliff for its best-selling cancer drug Keytruda.",2026-02-23 17:44:22,Yahoo,https://finnhub.io/api/news?id=45a57c4f981a31897cb98052d798fff89c70f59c764289c9ff6bafa9e26ec574,LLY
Novo Nordisk Shares Drop 15% After CagriSema Misses Phase 3 Goal,REDEFINE 4 shows 20.2% weight loss for CagriSema versus 23.6% for Lilly's tirzepatide over 84 weeks.,2026-02-23 18:01:22,Yahoo,https://finnhub.io/api/news?id=d3da4707519a52f3f1f17ac68ba09004e882be66f778e07adb4d83344eb3ef44,LLY
Why Viking Therapeutics Stock Is Up More Than 9% Today,A potential competitive threat to Viking's phase 3 weight-loss drug VK2735 was just dealt a major blow.,2026-02-23 18:03:19,Yahoo,https://finnhub.io/api/news?id=8c3a41c56988038f957c48ba9ace4ee0d8754720a1d749b6b5f22b6be84e1a1b,LLY
Final Trade: LLY and GDX,The final trades of the day with CNBC's Melissa Lee and the 'Fast Money' traders.,2026-02-23 18:09:52,CNBC,https://finnhub.io/api/news?id=51a4d631a8773be001b500536b912d1c35a3dad61a9ecfa0c7baf6dd4c13a4d6,LLY
Novo Nordisk Trips in the Obesity Race,Pill trial setback dents Novo’s obesity comeback hopes.,2026-02-23 18:10:57,Yahoo,https://finnhub.io/api/news?id=d2541c19d0889b5dfa8d6cdc693ebebf8fc6d92cfaa59cca553199af8f5d81bf,LLY
"Barclays Begins Coverage on Eli Lilly (LLY), Sees Strong Position in Obesity Market","Eli Lilly and Company (NYSE:LLY) is included among the 14 Best Low Volatility Dividend Stocks to Invest in. On February 20, Barclays initiated coverage of Eli Lilly and Company (NYSE:LLY) with an Overweight rating. The firm set a $1,350 price target on the stock. The firm said GLP-1 weight loss treatments represent a “durable structural […]",2026-02-23 18:12:37,Yahoo,https://finnhub.io/api/news?id=8598b3e42d3db5a88a5158f6240567abc89d85aa1d8f0e19fdf90bc30dcfcff1,LLY
"Equities, Treasury Yields Fall Intraday as Markets Weigh New Trump Tariffs",US benchmark equity indexes and Treasury yields fell intraday as investors assessed new tariffs anno,2026-02-23 19:10:14,Yahoo,https://finnhub.io/api/news?id=000b7bf31c5e1898777f2decd1562075b91c106d669a2e5dd60164aa0587ba9b,LLY
Allspring Premier Large Company Growth Fund Q4 2025 Top Contributors And Detractors,The Allspring Premier Large Company Growth Fund lagged its benchmark in Q4 2025 despite gains from Natera. Read the full analysis for more details.,2026-02-23 19:20:00,SeekingAlpha,https://finnhub.io/api/news?id=f07003b2e715707c4aec2a2ae72b096a985d79cf6e0f0e6a1dcc8a518e46660f,LLY
Eli Lilly (LLY) Expands Pipeline With Positive Trial Data and New Licensing Deal,"Eli Lilly and Company (NYSE:LLY) is one of Goldman Sachs’s top growth stock picks. On February 18, Eli Lilly and Company (NYSE:LLY) said using Taltz (ixekizumab) together with Zepbound (tirzepatide) worked better than Taltz alone in adults who had moderate-to-severe plaque psoriasis and also had obesity or were overweight. Eli Lilly said the results came […]",2026-02-23 19:51:09,Yahoo,https://finnhub.io/api/news?id=b02a20e984cff3caaf43ab739a236edf15f08ac823f718ad8b543219f4f1e474,LLY
Which S&P500 stocks are moving on Monday?,Stay updated with the movements of the S&P500 index one hour before the close of the markets on Monday. Discover which stocks are leading as top gainers and losers in today's session.,2026-02-23 20:05:05,ChartMill,https://finnhub.io/api/news?id=917f0bc826cf6180e0a97a3c03a6298042b0ae699af1c907abd4438f271501ac,LLY
Sector Update: Health Care Stocks Higher Late Afternoon,"Health care stocks rose late Monday afternoon, with the NYSE Health Care Index adding 0.6% and the S",2026-02-23 21:01:29,Yahoo,https://finnhub.io/api/news?id=66b417b8404a82f3f931c48f50de5af21d2e9613a9f37532b8f91c21671a95a7,LLY
"Eli Lilly (LLY) Stock Is Up, What You Need To Know","Shares of global pharmaceutical company Eli Lilly (NYSE:LLY) jumped 3.8% in the afternoon session after a major competitor, Novo Nordisk, announced that its experimental obesity drug failed to show it was as effective as Lilly's tirzepatide in a head-to-head clinical trial.",2026-02-23 21:05:42,Yahoo,https://finnhub.io/api/news?id=5ab95dc64114e3a25767e2d17754ee738f397b8d69fef037559ddeb8f34d6681,LLY
Novo Nordisk Stock Is Deeply Oversold on Weight Loss Drug Fail. Should You Buy the Dip?,Novo Nordisk stock tanks as CagriSema appears inferior to Eli Lilly’s competing weight-loss drug in a late-stage trial. But NVO shares are still worth buying at current levels.,2026-02-23 21:39:31,Yahoo,https://finnhub.io/api/news?id=6da30642fb81b766d58bd47e38a28de29e2d9cb5eb1170a192b84c4bc739a1ed,LLY
Dow Logs Worst Day in Nearly 5 Weeks Amid Renewed Tariffs Uncertainty; Tech Stocks Fall,The Dow Jones Industrial Average posted its biggest one-day drop in nearly five weeks on Monday amid,2026-02-23 21:51:26,Yahoo,https://finnhub.io/api/news?id=8ec2aaa30ed0e1dd06b28f2249c1a8dc7a1a484ba2be8c7aac35ff2615fc7d2e,LLY
"Stock Market Today, Feb. 23: Nvidia Earnings Loom as Tariff Concerns Drive Dow 800 Points Lower","AI jitters, tariff shock, and looming Nvidia results have investors fleeing growth for perceived safety, today, Feb. 23, 2026.",2026-02-23 22:31:55,Yahoo,https://finnhub.io/api/news?id=ba8070610858ab3a8f211085a882dbfd79b64fee552fb6198f8fbcb9f815e6eb,LLY
"Stocks to Watch Monday Recap: Diamondback, Netflix, Novo Nordisk, Lilly","↘️ Hims & Hers Health (HIMS): The telehealth platform said it expects growth to continue this year, though its first quarter guidance came in short of Wall Street’s expectations. Shares slipped 2% afterhours.",2026-02-23 22:33:45,Yahoo,https://finnhub.io/api/news?id=87b3309c7f73e534132512952506b9e1ed84cf06424a5b778a542fced94613f3,LLY
"Stock Market Today, Feb. 23: Novo Nordisk Plunges 16% After Obesity Drug Falls Short","Today, Feb. 23, 2026, a pivotal obesity‑drug trial setback forces investors to rethink Novo Nordisk’s strategy.",2026-02-23 22:41:16,Yahoo,https://finnhub.io/api/news?id=a5940d68e50ce63b7f554e71e0f072e49ffccd6925e6c9e107d40b6bb0fece61,LLY
How The Eli Lilly (LLY) Narrative Is Shifting Around Obesity Leadership And Valuation Risks,"Eli Lilly’s fair value estimate has shifted from US$1,093.22 to US$1,211.21, capturing an updated view of what analysts are willing to pay for its long term earnings power. That move aligns with recent research that emphasizes obesity leadership, cardiometabolic breadth, and deals like Ventyx, while still highlighting valuation and execution risks. As you read on, you will see how these factors shape the evolving narrative and what to watch as new opinions emerge. Stay updated as the Fair...",2026-02-23 23:13:39,Yahoo,https://finnhub.io/api/news?id=4585f45aec31cc24c64f82f2e695769028f1597771a6243cd63eabc43791cb40,LLY
"Got $5,000? Viking Therapeutics Might Be a Weight‑Loss Drug Moon Shot in the Making.",Is this the best way to cash in on the weight-loss gold rush?,2026-02-24 01:50:00,Yahoo,https://finnhub.io/api/news?id=b6d9ada71784254e3e59d11304e48f670fc5d4b1dca52f075f8bf3eb64ddc85e,LLY
CNBC Daily Open: Unstable tariff situation and new AI disruption spark market sell-off,Investors lost their sense of security in the business of cybersecurity companies after Anthropic on Friday launched an AI-powered security scanning tool.,2026-02-24 02:27:50,CNBC,https://finnhub.io/api/news?id=3fe00c4f095fce2986cc93bf04b1b2d6f635d2a5aeb406588da1133b2b103339,LLY
CagriSema Setback Tests Novo Nordisk Obesity Ambitions And Growth Story,Novo Nordisk (CPSE:NOVO B) reported that its next generation obesity drug candidate CagriSema did not meet the primary goal of non inferiority versus Eli Lilly's tirzepatide in a head to head Phase 3 trial. The readout from this pivotal study challenges Novo Nordisk's efforts to strengthen its position in the competitive market for injectable weight loss therapies. The result introduces fresh questions around CagriSema's commercial potential and the company's roadmap for future obesity...,2026-02-24 03:12:53,Yahoo,https://finnhub.io/api/news?id=da846c2821a3bab8750e068c78f7a8e356a42650a1cd1db06a74adc2be34ca27,LLY
Analysis-Novo's stumbles burnish Lilly's widening lead in weight-loss drugs,"By Maggie Fick and Bhanvi Satija LONDON, Feb 24 (Reuters) - With U.S. arch rival Eli Lilly streaking away on weight-loss prescriptions and valuation, the last thing Novo Nordisk needed was to give it",2026-02-24 05:11:40,Yahoo,https://finnhub.io/api/news?id=ef2675ed8a94f13d36d68c6dc93ccf6749cbaec8dd80953a9da169dca4f37c80,LLY
Is Eli Lilly Stock Underperforming the S&P 500?,"Eli Lilly has recently trailed the S&P 500 Index, though analysts remain confident in its longer-term trajectory.",2026-02-24 06:04:56,Yahoo,https://finnhub.io/api/news?id=0b2b70cec4b1794e1d2e5a9d35894e94252a85c64d3c170a9e31cfc6454adca3,LLY
