headline,summary,datetime,source,url,ticker
Can Novo Nordisk Hold Its Edge as the GLP-1 Battle With LLY Heats Up?,NVO gains ground in the GLP-1 battle as Ozempic outshines Trulicity in heart risk reduction and Rybelsus wins EU approval for added benefits.,2025-09-19 15:51:00,Yahoo,https://finnhub.io/api/news?id=9e19d06dc8120ac1e1966b1b9b6b5c5ed8ffd0a7fa2a4a7a5f750b8f24368dc9,LLY
Boost Your Portfolio With These Top-Ranked ETFs,"With the Fed's first 2025 rate cut and upgraded growth outlook, ETFs in tech, financials, industrials and health care could benefit from momentum.",2025-09-19 17:03:00,Yahoo,https://finnhub.io/api/news?id=c3a16726b91d0b08996b35a01e7c94129896f7eb5a7275e118581c668933c7f2,LLY
US Weighs Trump-Branded Website to Help Shop for Cheaper Drugs,"The initiative is part of Trump’s demands that drugmakers reduce their prices to align them with what other developed countries pay, according to the people, who spoke on condition of anonymity to discuss plans that are not yet public.  The proposed website would allow patients to search for specific medicines and be connected with platforms that sell them, the people said.",2025-09-19 20:42:55,Yahoo,https://finnhub.io/api/news?id=0e750c560c0ea09bf3dc6730b90444afd04249631e5b78e5380f5bdb5e0db388,LLY
Jim Cramer Explains Why Eli Lilly May Not Be Next to Hit $1 Trillion,"Eli Lilly and Company (NYSE:LLY) is one of the stocks Jim Cramer recently discussed. While talking about the company, Cramer said that investors are not “supposed to buy drug stocks” when the Fed is cutting rates. He remarked: “Not that long ago, pretty much everybody assumed that the next non-tech stock to cross the trillion-dollar […]",2025-09-20 05:45:00,Yahoo,https://finnhub.io/api/news?id=1978aef8bf3294fd8ec3582d5f09702bb0823101071bfa28ff9f9d10490e31b3,LLY
Jim Cramer Says the Next Trillion-Dollar Stock is “More Likely to Be the Stock of JPMorgan”,"JPMorgan Chase & Co. (NYSE:JPM) is one of the stocks stocks Jim Cramer recently discussed. Cramer said that it could be the next trillion-dollar stock. He stated: “The anomaly this time, it looks like the next trillion-dollar stock won’t be Eli Lilly. If anything, it’s more likely to be the stock of JPMorgan, a bank… […]",2025-09-20 05:45:02,Yahoo,https://finnhub.io/api/news?id=27128af528e3d0101e17f219c10b513ea2a168e3a9aff0c68dd4b4a18422ee77,LLY
2 Magnificent S&P 500 Dividend Stocks Down 7% and 19% to Buy and Hold Forever,These two underperforming stocks remain attractive for long-term dividend-seeking investors.,2025-09-20 18:25:00,Yahoo,https://finnhub.io/api/news?id=807d2c736ea0e73f752b472cf1971bc447496d4950e040abef0b3d77d3fae755,LLY
Eli Lilly: Orforglipron Sets Path Of Continued Revenue Growth In T2D And Obesity,Discover why LLY stock is rated Buy as sales surge in diabetes & obesity drugs and new treatments drive future growth.,2025-09-21 08:44:45,SeekingAlpha,https://finnhub.io/api/news?id=f97dd3c0f35cd08552c418c429ce689b9e3b0ebbca9ab0a6b35074cfc902c35c,LLY
Eli Lilly (LLY) Plans $5 Billion Virginia Facility to Boost Monoclonal Antibody Production,"Eli Lilly & Company (NYSE:LLY) ranks among the best fundamental stocks to buy right now. Eli Lilly & Company (NYSE:LLY) revealed plans on September 16 to build a $5 billion manufacturing facility in Goochland County, Virginia. This is the first of four new U.S. production locations that Eli Lilly & Company (NYSE:LLY) hopes to reveal […]",2025-09-21 09:11:29,Yahoo,https://finnhub.io/api/news?id=84e80b57c6266390cee66d8782365c4bbd1c361358c01ca79b61b27642de4d1e,LLY
Ozempic’s Maker Got Crushed. The Rebound Is Under Way.,"With a weight-loss pill on the horizon and the FDA’s signal of a tougher stance on compounded knockoffs, Novo Nordisk might be turning a corner.",2025-09-21 12:00:00,Yahoo,https://finnhub.io/api/news?id=341acef416513ced8e3aab07a296ca8ad5913fde3b49df89a40780b0ceca3e3a,LLY
Pfizer doubles down on weight-loss treatments with up to $7.3 billion Metsera buyout,"(Reuters) -Pfizer said on Monday it would acquire drug developer Metsera in a deal valued at up to $7.3 billion, including future payments, as it seeks to gain a foothold in the fast-growing obesity treatment market.  The global obesity drug market, projected to reach $150 billion by early 2030s, is fueled by the rapid adoption of GLP-1 therapies from companies such as Novo Nordisk and Eli Lilly.  Metsera brings its portfolio of experimental obesity drugs, with MET-097i, a GLP-1 injectable, and MET-233i, which mimics the pancreatic hormone amylin, being the key among them.",2025-09-22 04:04:17,Yahoo,https://finnhub.io/api/news?id=1e8ce91ef8cdfc09b120d5c789fa5e2e631201927611c215faa214dc67002aa4,LLY
Metsera Stock Surges Over 60% In Monday Pre-Market As Pfizer Reportedly Nears Acquisition Deal: PFE Stock Up 1.5%,"Pfizer Inc. (NYSE: PFE) stock climbed 1.87% in Monday pre-market amid reports that the company on the verge of acquiring Metsera Inc. (NASDAQ: MTSR), a developer of anti-obesity drugs.",2025-09-22 07:14:17,Benzinga,https://finnhub.io/api/news?id=d7e48c1d61ec2c2a022edd90c09f0a160796dbb2cd340b98c32e1a084a3a8ab8,LLY
Pfizer Buys Obesity Drug Developer Metsera: Buy Today And Benefit From CVRs,"Pfizer Inc. acquires Metsera, Inc. to re-enter the obesity drug market. Click for my look at PFZ and MTSR stock and where I see value in the weight loss sector.",2025-09-22 10:20:08,SeekingAlpha,https://finnhub.io/api/news?id=5bfff513063fe49ab6c7824a71faf28231baceff3d5fefb0fa928a0b51860a29,LLY
Pfizer: Metsera Acquisition Is The Missing Piece Of The Obesity Puzzle,"Pfizer Inc. acquires Metsera, Inc. for up to $7.5B, boosting its obesity pipeline with new therapies. Click for potential FDA action and the impact on PFE and MTSR.",2025-09-22 11:27:14,SeekingAlpha,https://finnhub.io/api/news?id=19babe5762d139880f0fd0145590c8b38d0f9dfcad1c250d24d334e5d7fb97ea,LLY
Pfizer seals up to $7.3bn takeover of weight loss drugmaker Metsera,Pfizer has sealed an up to $7.3bn takeover of weight-loss drug developer Metsera in the biggest deal yet by a large pharmaceutical group trying...,2025-09-22 11:32:26,Yahoo,https://finnhub.io/api/news?id=692f664f7c449a67518e4fc24fe417ab39deabe03b7ebf75afb719e0b388474f,LLY
Is Eli Lilly Stock a Buy After Gaining 10% in 1 Month?,The drugmaker continues to lead the increasingly competitive market for weight management drugs.,2025-09-22 12:25:00,Yahoo,https://finnhub.io/api/news?id=ccb505da79a436e983da59c67305c5ed0b8aaae7bf2eb72dc8f8ecd7057f2996,LLY
Pfizer ramps up obesity treatments push with 4.9 billion dollar deal for Metsera,Demand for obesity treatments has soared in recent years.,2025-09-22 12:27:15,Yahoo,https://finnhub.io/api/news?id=748d52633e4b2b1da19f7b797a126b90ea4edfad1b910d067a540332171e8c4e,LLY
Alzheimer’s Drug Franchise Decides Eli Lilly And Co.’s (LLY) Performance,"Macquarie Asset Management, an investment management company, released its “Macquarie Large Cap Growth Fund” investor letter for the second quarter of 2025. A copy of the letter can be downloaded here. The second quarter of 2025 endured significant government policy changes and geopolitical events, which resulted in volatility yet ended with robust performance for equity […]",2025-09-22 12:38:24,Yahoo,https://finnhub.io/api/news?id=d263e1c38a25537f3df42c3ee64578b4569ed77fb34b6200a0a6565450945bc4,LLY
Roche Targets Top Spot In Weight Loss Drug Market,"Roche advances weight loss drug CT-388 to Phase III, boosts pipeline with major acquisitions.",2025-09-22 14:04:15,Benzinga,https://finnhub.io/api/news?id=17348434ef04632e721c1b54b48e0de99477fcd5d197fee44f45bbcb6eeb1d83,LLY
Pfizer to Buy Weight-Loss Drug Developer Metsera for Up to $7.3 Billion,The deal returns the drug-maker to the growing market for obesity drugs after scrapping an experimental weight-loss pill.,2025-09-22 14:54:00,Yahoo,https://finnhub.io/api/news?id=541cc41b589b3df8b4e2e82bbbf7d27b4f89c3a32b0b9c084930f3a935f31e7a,LLY
Pfizer Jumps Back into the Weight-Loss Race With $4.9B Acquisition,"Pfizer said it would buy a clinical stage biopharma company for up to $7 billion, as it eyes the lucrative weight-loss drug market currently dominated by Eli Lilly and Novo Nordisk.",2025-09-22 15:17:00,Yahoo,https://finnhub.io/api/news?id=9b8c8de28a969383d59e5af39e03e393f1cff5e9dbef571b046ed9e90d96a1d0,LLY
Metsera: Long-Acting MET-097i And Product Differentiation Nets Pfizer Acquisition,"Metsera, Inc. is being acquired by Pfizer Inc. for up to $7.3 billion, driven by its innovative obesity drug pipeline. Click to read why MTSR is a Strong Buy.",2025-09-22 15:55:56,SeekingAlpha,https://finnhub.io/api/news?id=672546e5b973028908d86da56bd98a1fa63364fadd28e94952e97f8445426233,LLY
Pfizer joining GLP-1 race: How Novo & Eli Lilly compare,"Pfizer (PFE) is entering the weight-loss drug race with its acquisition of Metsera. BMO Capital Markets managing director of biopharma equity research Evan Seigerman Yahoo Finance Head of News Myles Udland on Market Domination to discuss how investors can play the GLP-1 trade in the pharmaceutical sector. To watch more expert insights and analysis on the latest market action, check out more Market Domination.",2025-09-22 21:00:00,Yahoo,https://finnhub.io/api/news?id=2a97c38ed56329e72c1038cab397f0480622db64fd59451ea74acc8fdd3bed0d,LLY
"Analysis: Innovent's weight-loss drug highlights China challenge for Novo, Lilly","SHANGHAI (Reuters) -Innovent Biologics' newly launched weight-loss drug is making inroads in its home market of China, ramping up competition with its Western rivals as it pursues a marketing strategy that is gaining traction.  Xinermei, launched in July, is the third once-weekly injectable GLP-1 weight management therapy available in China after Novo Nordisk's Wegovy and Eli Lilly's Mounjaro.  Those were introduced in late 2024 and January 2025 respectively, several months after their own approvals, into a Chinese weight-loss drug market that is expected by analysts to be worth billions in the coming years.",2025-09-22 23:03:15,Yahoo,https://finnhub.io/api/news?id=360aea5887bf62337dddef0d530308f973e0d52e1900159d14cf71458cc98a9d,LLY
"Celltrion unit pays $330 million for Eli Lilly production facility, filing shows","Celltrion Inc. said in a regulatory filing in South Korea on Tuesday its U.S. subsidiary has acquired Imclone Systems LLC from Eli Lilly in the United States for $330 million. In a statement, Celltrion said it aimed to complete the factory acquisition process by year-end in cooperation with its partner.",2025-09-23 01:32:15,Yahoo,https://finnhub.io/api/news?id=53c88a9bf0885486ef46f70b17ca2eab9c352661ece6f1b35ef32e7541cd174f,LLY
Roche's Giredestrant: A Ray Of Hope On A Cloudy Horizon?,"Swiss pharmaceutical and diagnostics giant Roche Holding has finally released some positive news about its oral breast cancer drug giredestrant, which...",2025-09-23 06:49:03,SeekingAlpha,https://finnhub.io/api/news?id=2efc93792c1b331494916e840656503106e5f3a92a2c0f1f6b4a81b2a45d6d96,LLY
"Lilly’s Alzheimer’s efforts depend on newer, better biomarkers and diagnostics","The pharma giant’s R&D in Alzheimer’s didn’t end with last year’s Kisunla approval, and diagnostics could define where the company goes next.",2025-09-23 07:11:01,Yahoo,https://finnhub.io/api/news?id=d4d1692995421e26388bf68f7684a2577a7e672a4126c7cc86a929825ab75d46,LLY
"India's Fortis to expand obesity clinics amid weight-loss therapy boom, CEO says","NEW DELHI (Reuters) -India's Fortis Healthcare plans to open more dedicated obesity clinics across its hospitals to meet surging demand for weight-loss drugs and therapies in the world's most populous nation, its CEO told Reuters.  The India launch of popular weight-loss drugs such as Eli Lilly's Mounjaro and Novo Nordisk's Wegovy this year has heightened patient awareness in the nation projected to have the world's second-largest population of obese people by 2050.  ""We are witnessing a sharp rise in patient interest and demand for structured guidance on weight management and newer obesity-related therapies,"" Fortis Managing Director and Chief Executive, Ashutosh Raghuvanshi, said in an interview earlier this month.",2025-09-23 07:33:51,Yahoo,https://finnhub.io/api/news?id=869758c149de8461893396e2170bf5d78f5295c5f6fef8f0a71e61132c59750e,LLY
This Hated Stock Suddenly Looks Like an Obesity Bargain,Pfizer’s latest deal could make it the budget entry point to the weight-loss bonanza.,2025-09-23 09:30:00,Yahoo,https://finnhub.io/api/news?id=7ecdd5182b6e8f7715ec43ddb4b17e33705785584c0bfe49734efb2f42abf830,LLY
SEED Therapeutics Completes $30 Million Series A-3 Financing,"KING OF PRUSSIA, Pa., Sept. 23, 2025 (GLOBE NEWSWIRE) -- SEED Therapeutics, Inc. (“SEED”), a clinical-stage biotechnology company pioneering rational molecular glue degraders for historically undruggable disease drivers, today announced the successful completion of its $30 million Series A-3 financing, alongside U.S. Food and Drug Administration (FDA) clearance of its Investigational New Drug (IND) application for its lead program targeting RBM39. The company anticipates entering first-in-human",2025-09-23 11:00:00,Yahoo,https://finnhub.io/api/news?id=f804cb51b10ef6a1d8bdceaa5b074d3a7ac9528a1979d5327a082dd6a1a9564d,LLY
CVS Health Drives Drug Affordability by Promoting Competition,"CVS strengthens Caremark's PBM edge with formulary shifts, new partnerships and cost-saving wins for clients.",2025-09-23 12:23:00,Yahoo,https://finnhub.io/api/news?id=6ab643017ac2470a0b23e3fb3e0524ab2f46f27856d880ccdb1d8d6424ccae53,LLY
Prellis Biologics Enters Multi-Target Drug Discovery & Development Collaboration with Lilly to Advance Human Antibody Therapeutics,"Prellis Biologics, Inc., a biotechnology company innovating human antibody discovery through organoid & artificial intelligence enabled technology, announced a multi-target drug discovery collaboration with Eli Lilly and Company (""Lilly""). In this strategic collaboration, the unique capabilities of Prellis' EXIS™ and AntiGen AI platforms will accelerate the discovery of highly diverse and fully human antibodies for multiple disease targets.",2025-09-23 13:00:00,Yahoo,https://finnhub.io/api/news?id=a0c87016ecaa0206036bea5a7688103f8ff7b2eb90d67496c9035d9c3abd9886,LLY
UBS slashes global GLP-1 sales estimate for 2030 on softer outlook,"Investing.com -- UBS has cut its global GLP-1 sales forecast for 2030 to $130 billion, down from over $150 billion, citing weaker-than-expected data from next-generation assets and compounded product disruptions in the US market.",2025-09-23 13:47:31,Yahoo,https://finnhub.io/api/news?id=a58ff7849e06cc4a7e0d32b5e8eadd19177ffe2446c5654cfd9af002ff7daab0,LLY
Can oral GLP-1RAs deliver on the promise of accessible obesity care?,Eli Lilly and Novo Nordisk are in a tight race to capture the lucrative oral obesity drug market – but how will their competing treatments reshape the landscape?,2025-09-23 14:15:05,Yahoo,https://finnhub.io/api/news?id=fcc60b347f0722aad141e34ce2db0a6b427c2c429a851ead27a5d95c6e963fd1,LLY
LifeSpan Portfolio Company Remedium Signs Landmark Deal with Eli Lilly,"Lifespan Vision Ventures is pleased to announce that its portfolio company, Remedium Bio, Inc. (""Remedium""), has entered into a multi-target research and development collaboration with Eli Lilly and Company (""Lilly"") focused on advancing innovative gene therapies for Type 2 diabetes and obesity.",2025-09-23 14:37:00,Yahoo,https://finnhub.io/api/news?id=c21a001173776ac424afee38d59a79839afba6de7c185caaac2159e723ea0111,LLY
The Magnificent 7 Boom Just Triggered A Dot-Com Era Warning,"The Magnificent Seven tech giants are now worth $21 trillion—8x more than top health care stocks, echoing dot-com bubble extremes.",2025-09-23 15:58:56,Benzinga,https://finnhub.io/api/news?id=29e169187d7b9c87e114c0b3e4cc85d63f66b962b4c614fa50c8b6f092c455fc,LLY
Can PFE Successfully Return to the Obesity Space With Metsera Buyout?,"Pfizer strikes a $4.9B deal for Metsera, adding obesity drug candidates to its pipeline after scrapping danuglipron.",2025-09-23 16:16:00,Yahoo,https://finnhub.io/api/news?id=9a2ba6748f1ef7cb2b9739e59f5abfc8c9b43a062b5604ecf47fb0f655cc5775,LLY
Eli Lilly & Co. stock underperforms Tuesday when compared to competitors,Eli Lilly & Co. stock underperforms Tuesday when compared to competitors,2025-09-23 16:31:00,MarketWatch,https://finnhub.io/api/news?id=6bd6fbe406c53747e06d66b976cc640c7e8a0b4a018ecfad3db4ff87b6211589,LLY
Lilly plans to build a new $6.5 billion facility to manufacture active pharmaceutical ingredients in Texas,"Eli Lilly and Company (NYSE: LLY) announced today that it plans to build a new $6.5 billion manufacturing facility at Generation Park in Houston, Texas. This planned next-generation synthetic medicine active pharmaceutical product (API) facility, the second of four new U.S. sites Lilly will announce this year, will focus on manufacturing the company's pipeline of small molecule medicines across therapeutic areas, including cardiometabolic health, oncology, immunology and neuroscience. It is expe",2025-09-23 17:00:00,Yahoo,https://finnhub.io/api/news?id=019f060e356792f3f3301a1e8a4edb865beb364b4d37ffb286b28922174b5add,LLY
Eli Lilly to build new USD6.5 billion manufacturing facility in Texas,,2025-09-23 17:29:06,Fintel,https://finnhub.io/api/news?id=0312022b8b5eb63e4f2abc6a6c7c36f1fbecc45f9b77a220868e1e54046889e8,LLY
Eli Lilly to Build $6.5 Billion Texas Facility to Boost U.S. Ingredient Manufacturing,"The planned site, which will be used to manufacture the company’s first oral weight-loss drug, is expected to be operational within five years.",2025-09-23 18:01:00,Yahoo,https://finnhub.io/api/news?id=4eeeb3bf29c9d86f37aeaba2cb88bd54186383686b4f8a106b9f0a079eb71333,LLY
Sector Update: Health Care Stocks Edge Higher Late Afternoon,"Health care stocks edged higher late Tuesday afternoon, with the NYSE Health Care Index adding 0.1%",2025-09-23 19:49:25,Yahoo,https://finnhub.io/api/news?id=27a42f39c520d30361c9a0ef7bc0fbda2c8c64f3fb0189309b672c34248b08c8,LLY
"Top Analyst Reports for Apple, Eli Lilly & Chevron","Apple grows Services with over 1B subscribers, while Eli Lilly and Chevron face mixed industry and market dynamics.",2025-09-23 20:45:00,Yahoo,https://finnhub.io/api/news?id=fe86442bade40a951990c8fa285c4d2a65f448c2dd0e750497812f32c154d28d,LLY
Eli Lilly (LLY) Falls More Steeply Than Broader Market: What Investors Need to Know,"In the closing of the recent trading day, Eli Lilly (LLY) stood at $746.98, denoting a -1.06% move from the preceding trading day.",2025-09-23 21:45:03,Yahoo,https://finnhub.io/api/news?id=36004b9cd2950db22cb140dfbf731787e1fff022cdd142576c4d38e0cef32560,LLY
Time to Buy Pfizer (PFE) or Metsera (MTSR) Stock?,"Making a major move in the obesity drug market, Pfizer (PFE) announced on Monday that it plans to acquire biotechnology firm Metsera (MTSR).",2025-09-23 22:55:00,Yahoo,https://finnhub.io/api/news?id=54f4cd504bf42239ad333789ab57451e151f59893e508226cefb66f6d500d3c2,LLY
Eli Lilly and Company (LLY) Unveils $5B Virginia Facility to Ramp Up Bioconjugate and Monoclonal Antibody Production,"In this article, we will be taking a look at the 10 Best Pharma Stocks to Buy According to Billionaires. Eli Lilly and Company is one of them. Eli Lilly and Company (NYSE:LLY) tops our list for being one of the best pharmaceutical stocks. It is the Indianapolis-based pharmaceutical giant and is accelerating its dominance in […]",2025-09-23 23:01:44,Yahoo,https://finnhub.io/api/news?id=ec92f70362726fb6ae89af7c80b176f07cc779711119690f635f1fe16735d4cf,LLY
Direxion's Ultra-Leveraged CURE ETF Offers An Opportunity To Play The Potential Valuation Reset, ,2025-09-24 08:08:41,Benzinga,https://finnhub.io/api/news?id=23f295c202291b6a106fdcb4164d22b324e11182c9a2e43bbcae2a8160ce3f25,LLY
Eli Lilly's boss calls UK the 'worst' European country for drug prices,"LONDON (Reuters) -Eli Lilly Chief Executive Dave Ricks said Britain was ""probably the worst country in Europe"" for drug prices in an interview with the Financial Times, intensifying pressure on the government to improve market conditions for drugmakers.  The remarks are part of a broader backlash from pharmaceutical giants, including Merck and AstraZeneca, who have paused or scaled back investments in Britain over the challenging environment.  Ricks said Britain would miss out on new drugs if it did not raise prices and scrap a rebate scheme which requires companies to contribute a portion of their UK drug revenue to the state-run NHS.",2025-09-24 08:11:40,Yahoo,https://finnhub.io/api/news?id=299e5d1ae0fcaa078a7352e2f66df3c7435c3b5b79781559c07c82aaaa04bb76,LLY
Lilly to invest $6.5bn in API manufacturing facility in Texas,The Houston facility is the company’s eighth US manufacturing site announced since 2020.,2025-09-24 08:39:29,Yahoo,https://finnhub.io/api/news?id=228b5e8e8905a59a2197f772212b32d6ffeb271b7a785dae85352fdc293010dc,LLY
"The Zacks Analyst Blog Highlights Apple, Eli Lilly, Chevron and Monarch Cement","Apple, Eli Lilly, Chevron, and Monarch Cement show mixed performance, with growth in services, strong drug demand and strategic acquisitions.",2025-09-24 09:10:00,Yahoo,https://finnhub.io/api/news?id=763acbef2606099f6dcd9cf334444d92c997c2c0a2f7d0896c192e7cc2ee1a09,LLY
Amgen: Imdelltra Could Be The Next Game Changer,,2025-09-24 10:17:30,SeekingAlpha,https://finnhub.io/api/news?id=a15d953742da50b01f3453fd76eb35d73a9e11cbcaa6e56e032929c5a6813b78,LLY
How Will Eli Lilly’s Mounjaro Trial Results Shape Its 2025 Valuation?,"If you have been keeping an eye on Eli Lilly’s stock, you are not alone, and you are probably wondering if now is the right moment to make your move. The last five years have been nothing short of remarkable, with shares surging over 440.2%. While few stocks can boast that kind of long-term growth, the road lately has had more bumps. The stock is down 2.3% in the last week and remains almost 19% below where it stood a year ago. However, over the last month, investors have gotten a bit of...",2025-09-24 11:39:03,Yahoo,https://finnhub.io/api/news?id=752390bb5bf659eda2c46f71776f8b91ae8ba3f74aa66ea22c4a26a2bce3318b,LLY
Eli Lilly to build $6.5bn orforglipron production site in Texas,The API facility is part of Eli Lilly’s $27bn US manufacturing drive.,2025-09-24 11:40:48,Yahoo,https://finnhub.io/api/news?id=ffe4249466168ff87aeba6c5a010eb611b325973c3013a48fef93014695ef56e,LLY
Lilly to build $6.5B Houston factory for its first obesity pill,The pharmaceutical giant’s expansion into Texas will create 615 full-time jobs and receive $5.5 million in state funding.,2025-09-24 12:13:00,Yahoo,https://finnhub.io/api/news?id=ec89b5bde8fd06d2cdcebbd344f3c774fe25daf187eb7dde6d8c2595ede3ee1d,LLY
LLY vs. NVO: Which Obesity Drug Stock Is the Better Buy Now?,"Eli Lilly's diversified pipeline, rapid tirzepatide growth and rising estimates give it the edge over Novo Nordisk in the obesity drug battle.",2025-09-24 16:25:00,Yahoo,https://finnhub.io/api/news?id=07331e108658c7db68779258eaf6906b842da0469b7e09acd3da1b6bc104f606,LLY
Podcast: How oral GLP-1RAs are set to impact the obesity market,"As Eli Lilly and Novo Nordisk await approval of their oral GLP-1RAs, the healthcare editorial team discuss data and market opportunity.",2025-09-24 17:43:26,Yahoo,https://finnhub.io/api/news?id=9afa70e828c131f3f4f9f69966c58ab74c940a851bd8641457a95baa571f12ef,LLY
Does Eli Lilly's New $5 Billion Drug Manufacturing Facility Make It a Long-Term Buy?,"Once up and running, it and other projects should make the company's supply chain stronger.",2025-09-24 20:44:38,Yahoo,https://finnhub.io/api/news?id=8cf6386dfee6bed163a4014ccea9ca11991ef169a385ea7819f2cea7023e1f7f,LLY
Eli Lilly plans to bring experimental weight-loss pill in India,"MUMBAI (Reuters) -Eli Lilly plans to launch its experimental oral weight-loss drug orforglipron in India, a senior executive said on Thursday, offering an alternative to injectables that many patients in the world's most populous nation resist.  Orforglipron is part of a new class of GLP-1 drugs that suppress appetite and follow the same pathway targeted by Eli Lilly's blockbuster tirzepatide, sold globally as the blockbuster Mounjaro for diabetes and Zepbound for weight loss.  The drug has not been launched anywhere globally but Lilly plans to file for approval of orforglipron with regulators in the United States, Britain, European Union, Japan and China.",2025-09-25 05:12:26,Yahoo,https://finnhub.io/api/news?id=b1c1d532bdfa4de846d9d2efc3eb3f5ec697428205bbea6f3e2df88a2741a3ce,LLY
Can a multibillion-dollar deal put Pfizer in the obesity big leagues?,"After a couple failed attempts on its own, Pfizer is hitting the M&A gas to bring in candidates that could help it become a weight loss heavyweight.",2025-09-25 08:00:00,Yahoo,https://finnhub.io/api/news?id=78b04e842307cb30b0d4566de77ac5e4d752edf54bae418ae5c664d9c31b2193,LLY
Pfizer Is Buying Weight Loss Biotech Metsera. Here's Why Viking Therapeutics Shareholders May Be Cheering.,Investors once speculated that Pfizer might consider acquiring Viking.,2025-09-25 08:12:00,Yahoo,https://finnhub.io/api/news?id=8187fb09c720eb0007c590e51e1b37224fdee0f1d3710cfcb8f8717e859fd2e2,LLY
Eli Lilly: Buying The Dip With Confidence,"Discover why Eli Lilly is a strong buy, led by innovative diabetes drugs and AI-driven research.",2025-09-25 10:53:34,SeekingAlpha,https://finnhub.io/api/news?id=d1384f3f931f5cbf057b501c14eee477eedf5d743c1761be674e1e8a21cf8dfb,LLY
Eli Lilly Ends Bimagrumab Obesity Study Weeks After Launch,"On Wednesday, Eli Lilly &amp; Co. (NYSE: LLY) ended a mid-stage study of its experimental drug bimagrumab in obesity patients with type 2 diabetes, just weeks after it began.",2025-09-25 11:23:56,Benzinga,https://finnhub.io/api/news?id=fb63c735bdc8c9dfb6b3104c1e5e08e5d0ff9b89e92b5175e439e97836082b83,LLY
