headline,summary,datetime,source,url,ticker
Lilly to present data from two positive Phase 3 studies of Jaypirca (pirtobrutinib) in chronic lymphocytic leukemia at the 2025 American Society of Hematology (ASH) Annual Meeting,"Eli Lilly and Company (NYSE: LLY) today announced that data from studies of Jaypirca (pirtobrutinib), the first and only approved non-covalent (reversible) Bruton tyrosine kinase (BTK) inhibitor, will be presented at the 67th American Society of Hematology (ASH) Annual Meeting and Exposition, taking place Dec. 6-9 in Orlando, Florida.",2025-11-24 17:00:00,Yahoo,https://finnhub.io/api/news?id=0ccb02c5de26d2eaddba29a487884fbf0e5688e4643155469c7b118713397f65,LLY
Moderna is the S&P 500's most shorted stock: Here's why,"President Trump is expected to unveil plans to lower healthcare costs, which could significantly impact the pharmaceutical industry. Additionally, Pfizer's (PFE) entry into the weight-loss drug space, joining Novo Nordisk (NVO) and Eli Lilly (LLY), will also likely make waves. Yahoo Finance Senior Reporter Brooke DiPalma and Yahoo Finance Senior Business Reporter Ines Ferré join Opening Bid host Brian Sozzi to take a closer look at one frequently overlooked pharmaceutical name: Moderna (MRNA). To watch more expert insights and analysis on the latest market action, check out more Opening Bid.",2025-11-24 17:30:15,Yahoo,https://finnhub.io/api/news?id=074ab3f0f60823d93da8c1893319c62e7dc0649084f6b785072526aaabcf9eaa,LLY
"This Healthcare Company Just Touched $1 Trillion in Market Cap. Should You Invest $1,000?",The rapidly expanding market for GLP-1 drugs has added massively to Eli Lilly's market cap.,2025-11-24 17:35:49,Yahoo,https://finnhub.io/api/news?id=a7399bb3673bcda91cd8060e981aae1d2cb64c0608196c8f3416e42cba8a5f96,LLY
"Stock Market Today: Dow, Nasdaq Up As Alphabet, Tesla Jump; These Health Plays Test Entries (Live Coverage)","The Dow Jones index and the Nasdaq rose on the stock market today, with Tesla and Alphabet among AI stocks jumping. Health stock tested entries.",2025-11-24 17:42:16,Yahoo,https://finnhub.io/api/news?id=1be78d575ac99d4ec0f939f4d78fac9c8abceae69847c82c79933cc0bd0f6443,LLY
Sector Update: Health Care Stocks Advance in Afternoon Trading,"Health care stocks rose Monday afternoon, with the NYSE Health Care Index up 0.5% and the Health Car",2025-11-24 18:46:21,Yahoo,https://finnhub.io/api/news?id=23dcd43d4d13da9d5009b05da5a2c895470d9290d173e98ec9ea32586b5a76e6,LLY
Stock Market Today: Nasdaq Surges On Tech Spike; These Defense Stocks Fall Amid Ukraine Progress (Live Coverage),"The Dow Jones index and the Nasdaq rose on the stock market today, with Tesla and Alphabet among AI stocks jumping. Health stocks tested entries.",2025-11-24 19:03:40,Yahoo,https://finnhub.io/api/news?id=c607618f2af4a40052d36008baadd6f292ee13e988c796371e291e14f35248ef,LLY
Sector Update: Health Care Stocks Advance Late Afternoon,"Health care stocks rose late Monday afternoon, with the NYSE Health Care Index adding 0.3% and the H",2025-11-24 21:01:41,Yahoo,https://finnhub.io/api/news?id=460e60e923ef496cb8beff5eee75a7070b92f2761dafd9207fb5d3255fcecae8,LLY
Lilly to highlight progress across key programs in early and advanced hormone receptor-positive breast cancer at the 2025 San Antonio Breast Cancer Symposium,"Eli Lilly and Company (NYSE: LLY) today announced that new data from across its breast oncology portfolio and pipeline will be featured at the San Antonio Breast Cancer Symposium (SABCS), taking place December 9–12 in San Antonio, Texas. These updates reflect Lilly's continued progress across key pathways in hormone receptor–positive (HR+), human epidermal growth factor receptor 2-negative (HER2–) breast cancer, the most common form of breast cancer.1",2025-11-24 21:30:00,Yahoo,https://finnhub.io/api/news?id=b719a03e6bc0b7e5c44d93cae5546660b1d94c6ee93a97c6a224692c79fa63d4,LLY
Bernstein Maintains Eli Lilly and (LLY) Outperform Recommendation,,2025-11-25 00:03:08,Fintel,https://finnhub.io/api/news?id=451fadd2c2dec4bbef569bee841c9abd2f35c03fc5d68348509eb769b04138db,LLY
Morgan Stanley Maintains Eli Lilly and (LLY) Overweight Recommendation,,2025-11-25 00:04:08,Fintel,https://finnhub.io/api/news?id=8d387f15696b76ee829d4671e6b5aeeb0f429cdc73c677b127119c209a343877,LLY
4 takeaways from pharma’s manufacturing boom,"As pharma’s U.S. facility investments top $370 billion over the next five years, there are a few things to keep in mind, according to construction experts.",2025-11-25 08:00:00,Yahoo,https://finnhub.io/api/news?id=233c1cf0383ff95697693c76296957c552c00161be33434d5f001e66289d5726,LLY
"Novo Nordisk's Longshot Alzheimer's Trial Didn't Work, But It Is Still Worth Buying","Novo Nordisk A/S remains a Strong Buy despite semaglutide's Alzheimer's trial miss. Click for NVO growth drivers, solid fundamentals, and attractive dividend yield.",2025-11-25 08:37:58,SeekingAlpha,https://finnhub.io/api/news?id=05145ad236af590705887e122f08d0114b2a465ed3c669a309f7de02364eaa26,LLY
"The Zacks Analyst Blog Highlights LLY, EPHE, BBC, HELX, XHS and SURI","LLY, EPHE, BBC, HELX, XHS and SURI headline last week's top-performing ETFs as healthcare and biotech outperform a weak broader market.",2025-11-25 08:44:00,Yahoo,https://finnhub.io/api/news?id=f9873fa52c6e96faad476dc934b2a63bbf431aecba27b222d99c3ccc51162008,LLY
How Is Eli Lilly’s Stock Performance Compared to Other Pharmaceuticals?,"Eli Lilly’s remarkable outperformance within the pharmaceutical sector hasn’t tempered enthusiasm, analysts are still strongly bullish on its long-term growth potential.",2025-11-25 10:52:29,Yahoo,https://finnhub.io/api/news?id=1ce5b58b1dca199650404b993c7f5fc09df2c09891de12e606e59bb8ef2c944f,LLY
Citizens Financial Group And 2 Other Stocks That May Be Priced Below Their Estimated Worth,"As the U.S. stock market kicks off a holiday-shortened trading week with significant gains, investors are buoyed by optimism around a potential Federal Reserve interest rate cut in December. In this environment of heightened confidence, identifying stocks that may be undervalued compared to their estimated worth can be particularly appealing, as they offer opportunities for growth amidst broader market enthusiasm.",2025-11-25 11:38:00,Yahoo,https://finnhub.io/api/news?id=d56f2d6e17b16b3633d0b901d5b344759e1378d835fafb314f01867ec73a9caa,LLY
"J&J Up Around 17% in 3 Months: Should You Buy, Sell or Hold the Stock?","J&J's 16.7% rise reflects stronger sales guidance, rapid pipeline advances and improving MedTech momentum amid a recovering sector.",2025-11-25 12:24:00,Yahoo,https://finnhub.io/api/news?id=42ccd668993012cedf9961a5de78b1ccac4b109d2a8e69f66ad59467c5c6ace0,LLY
Healthcare ETF (IYH) Hits New 52-Week High,"IYH hits a 52-week high as healthcare gains momentum, lifted by sector strength and rising investor interest in safety and AI-driven tailwinds.",2025-11-25 12:47:00,Yahoo,https://finnhub.io/api/news?id=9946197063791f40cad51eb88fd38311414849a029d08b3247c35002a52f0dc7,LLY
"Novo Nordisk: Forget About Alzheimer's, The Real Catalyst Is The Wegovy Pill",Novo Nordisk A/S is rated a Strong Buy with a huge unmet demand in obesity treatment and a low 13x P/E ratio. Learn more about NVO stock here.,2025-11-25 13:18:09,SeekingAlpha,https://finnhub.io/api/news?id=b8743f3aa444808cb2dd9dee9ac74ca94973036da90d9a19385cd3090fcfb301,LLY
A Trillion-Dollar Pill: Eli Lilly Broke the Healthcare Ceiling,Eli Lilly became the first drugmaker to surpass a trillion-dollar valuation by driving revenue through mass market adoption rather than price increases.,2025-11-25 13:39:00,Yahoo,https://finnhub.io/api/news?id=f5ebc6479a226a03407fd6ed817f771ac3cc4ccf20297dcff28044c0a88994d5,LLY
Redditors Are Buying Eli Lilly And Co (LLY) Ahead of Potential End of AI Trade. Here’s Why,"We recently published Top 10 Non-AI Stocks Redditors are Buying Ahead of Potential Bubble Burst. Eli Lilly And Co (NYSE:LLY) is one of the top non-AI stocks redditors are buying. Eli Lilly And Co (NYSE:LLY) recently posted strong quarterly results amid robust growth from its diabetes and weight-loss products. With a diverse portfolio spanning oncology, […]",2025-11-25 13:40:37,Yahoo,https://finnhub.io/api/news?id=249ebb2f810f30f8bd45869e554ca254e93a5db292cb929b3508a0db406a2cce,LLY
"Novo Nordisk Drug Helps Patients Lose Weight, Lower Blood Sugar in Trial","The pharma giant said amycretin helped patients lose weight and reduce blood-sugar levels in pill and injection forms during a mid-stage trial, lifting shares in the company.",2025-11-25 14:47:00,Yahoo,https://finnhub.io/api/news?id=3f8dda141eaeb677c0d049cc4fc37fbbe61b52bfb7065187b61304824f7b6576,LLY
Novo Nordisk Stock Jumps on Positive Weight-Loss Drug Data. Why It Deserves Better.,"Shares, though, were punished Monday after the drug maker said its blockbuster obesity treatment Wegovy failed to slow Alzheimer’s.",2025-11-25 14:51:00,Yahoo,https://finnhub.io/api/news?id=b0283a3dc8885651cfbff03768f4cf3481f167d55b85a0fa96030016cb3178f1,LLY
AI Just Sparked Biotech's Biggest Rally Since 2004 — Why Isn't Anyone Talking About It?,"While most eyes are on tech and chipmakers, biotech is quietly staging its biggest rally in over two decades.",2025-11-25 16:14:52,Benzinga,https://finnhub.io/api/news?id=f7c56b1faad0a7abc1c0601bc29f1b3755424926bd7b23c0fe63212f9c414900,LLY
Top analyst drops jaw-dropping price target on Eli Lilly stock,"Bernstein just threw fresh fuel on Eli Lilly's (LLY) never-ending rally, as the firm lifted its price target on the stock to $1,300 from $1,100. For perspective, that’s an 18% bump compared to the old target, while representing a 21% to 22% upside compared to Lilly’s current stock price. ...",2025-11-25 17:33:00,Yahoo,https://finnhub.io/api/news?id=da8967cdebc44d4eba388b37def20950b2eee8f03f4f1fd2e1b4dd234f4193c4,LLY
Novo's Comeback Shot? Weight-Loss Drug Triggers Surprise Rally After Brutal Stock Crash,A promising next-gen diabetes treatment just gave Novo Nordisk its first real jolt of hope in months.,2025-11-25 17:58:07,Yahoo,https://finnhub.io/api/news?id=1ec5cab16dd847471c0de510fd905da76bdc43e7c06b216c974d7118b57ccaef,LLY
Rigel Pharmaceuticals: Behind The Huge Rally,"Rigel Pharmaceuticals, Inc. posted a solid Q3 with robust sales growth. Discover insights on future profitability and market outlook. Click for this RIGL update.",2025-11-25 18:01:00,SeekingAlpha,https://finnhub.io/api/news?id=10fbd8308888c851886c7082538a7288263114dce4c7cb41a05476e07a17c038,LLY
Here's Why Novo Nordisk Stock Popped Today,Good news from a GLP-1 receptor agonist clinical trial hit the market today.,2025-11-25 18:37:41,Yahoo,https://finnhub.io/api/news?id=0e2b12bd139d542c75dee527f96dfd8a0d14d173a42ede7ecb98aaaa2ae4f596,LLY
Trump administration slashes Ozempic and Wegovy price for Medicare,The US government has negotiated a 71 per cent discount for Novo Nordisk’s weight-loss drugs Ozempic and Wegovy for patients enrolled in Medicare...,2025-11-26 01:52:57,Yahoo,https://finnhub.io/api/news?id=2bb7925fbb7033900802b33e9d5c2abeb0bb77587d53892f8fad367af95ac96d,LLY
"JPMorgan Raises Eli Lilly (LLY) Price Target to $1,150, Maintains Overweight Rating","Eli Lilly and Company (NYSE:LLY) is included among the 15 Best Stocks to Buy for Medium Term. On‍ November 18, JPMorgan analyst Chris Scho‍tt r‌aised the firm‍’s‍ price ta‌rg​et on Eli Lilly and Company (NYSE:LLY) to $1,150 from $1,050 wh‍ile maintaining an Overw‍eig​ht ratin⁠g after meetings with management. JPMorgan said the di‌scu‌ss⁠ions‌ re‌inforced its positive […]",2025-11-26 06:08:31,Yahoo,https://finnhub.io/api/news?id=7e8635288d3741e58ff8490d63c115cc6b9ea7db73ea89eb47e61c43f49e079f,LLY
Medicare Announces Price Cuts For 15 Drugs— Novo Nordisk's Wegovy And Ozempic To Cost $274 A Month,The U.S. Centers for Medicare and Medicaid Services (CMS) on Tuesday announced that it has secured lower prices for 15 of its highest‑cost medications.,2025-11-26 06:11:45,Benzinga,https://finnhub.io/api/news?id=26d52ce9cef4e9995f3fe9aa0017fc29c888dcdc9957209bfb6916e02729bace,LLY
Wall Street Breakfast Podcast: HP Downsizes To Power Up,"HP slides after weak forecast, job cuts. Trump admin negotiates 71% discount on Ozempic, Wegovy for Medicare patients. Foxconn gets approval to invest additional $569M in Wisconsin.",2025-11-26 06:50:39,SeekingAlpha,https://finnhub.io/api/news?id=a942a62f72b23c608a451ab469f57d4acc8bca4a6924bb12b022b1ab556113b8,LLY
"Did Pfizer Just Say ""Checkmate"" to Novo Nordisk?",The weight loss drug market may approach almost $100 billion by the end of the decade.,2025-11-26 09:15:00,Yahoo,https://finnhub.io/api/news?id=b30b4cd1f3a84357ae367cd118fe2c01deb185a5b1a837a9949b5ef9aa751525,LLY
"Healthcare ETFs Trounce Tech, Grab Billions As Big Money Flees Bubble Fears","Healthcare ETFs are raking in fresh inflows while tech bleeds, reflecting a defensive shift as investors grow wary of frothy valuations.",2025-11-26 10:25:07,Benzinga,https://finnhub.io/api/news?id=6fb647d7a3f595be969e0322762764caab8be34b0a7b9b5bc02807b85584279a,LLY
Hedge Funds Pile Into Health Stocks Leading Market in Rotation,"The S&P 500 Health Care Index is up 10% through Tuesday, outperforming the other 10 sectors in the benchmark for US stocks.  Eli Lilly & Co. has surged 29% to become the first health company with a $1 trillion valuation.  Regeneron Pharmaceuticals Inc., Merck & Co. and Biogen Inc. are all up at least 18% since the end of October.",2025-11-26 10:30:00,Yahoo,https://finnhub.io/api/news?id=3768daf75b4e70ec346d2eb5b0e4f04e7f887660fac02bb04248c747f2d50a79,LLY
CMS Unveils 2027 Rule To Refocus Medicare Advantage On Outcomes,"CMS outlines a 2027 Medicare rule proposing major Star Ratings updates, a new behavioral health measure, and streamlined enrollment options for beneficiaries.",2025-11-26 10:40:22,Benzinga,https://finnhub.io/api/news?id=e2f7657e333228132b96244a6d76d8ff318e42698d24b167d292cda366fe473e,LLY
Novo Nordisk Faces 71% Medicare Price Cuts on Ozempic and Wegovy,U.S. government move slashes costs for key diabetes and weight-loss drugs beginning in 2027.,2025-11-26 11:13:29,Yahoo,https://finnhub.io/api/news?id=ed506b972a72dcf0b5103dbeca95ddc5db03408d95df088cbc3f5b9b40472097,LLY
Jim Cramer Discusses Eli Lilly (LLY) Touching the Trillion Dollar Market Value,We recently published 11 Stocks Jim Cramer Shared His Insights On. Eli Lilly and Company (NYSE:LLY) is one of the stocks Jim Cramer discussed. Eli Lilly and Company (NYSE:LLY) is one of Cramer’s top stocks in the pharmaceutical space. He has remained optimistic about the firm throughout the year and praised its lead in the weight […],2025-11-26 11:29:53,Yahoo,https://finnhub.io/api/news?id=a1e53b0b80bf741f671df76ef880c2f4e150c221021a89cde0da2d72d6670a08,LLY
"Why Medicare price negotiations matter for Novo Nordisk, AstraZeneca, and other European pharma companies","Pharma companies are facing pricing pressure from several directions, including from the U.S. Medicare negotiations",2025-11-26 12:18:29,CNBC,https://finnhub.io/api/news?id=88b71e4c01ec422b59073a29aa50ec62b533a6d7d826368bff9384a4b21a2226,LLY
"BMO Launches New CDRs With Exposure to U.S. Stocks Including Microsoft, Eli Lilly, Exxon, Chevron and Robinhood",Bank of Montreal (BMO) announced five new Canadian depositary receipts (CDRs) will begin trading on the Cboe Canada exchange today. The initial offering of these new CDRs has closed.,2025-11-26 12:30:00,Yahoo,https://finnhub.io/api/news?id=591f8d13f7d4ec74df4d576a469d68995441deea3fedab35e7bef8837ff8a4da,LLY
"The AI Pharma Rally Is Real — And Cancer May Soon Be Chronic, Not Deadly","Large pharma companies are facing severe patent cliffs, where blockbuster drugs lose exclusivity and revenue plummets.",2025-11-26 12:55:22,Benzinga,https://finnhub.io/api/news?id=be47034c0779546e2a7beb4f4d3e9ea7049d1c97b31788449cb3778eb304f7cb,LLY
10 Health Care Stocks With Whale Alerts In Today's Session, ,2025-11-26 13:35:27,Benzinga,https://finnhub.io/api/news?id=efd40986952852aae978a92ad38f632aa269790449f41929d1bd506daf5297dc,LLY
Healthcare Equity ETF (GDOC) Hits Fresh 52-Week High,"GDOC hits a 52-week high as aging demographics, tech advances and strength from top holding LLY fuel momentum.",2025-11-26 14:24:00,Yahoo,https://finnhub.io/api/news?id=d1925fe95eb3d06f463ac9d42576bb21e5798992a7bf0131b06ad0b79d0b6032,LLY
Stock Split Watch: Is Eli Lilly Next?,"The stock recently reached beyond $1,000.",2025-11-26 15:30:00,Yahoo,https://finnhub.io/api/news?id=af652cea620ad4e4c8719b22c992501f9d7205a2459e045f2e53504a4bc1bb72,LLY
AbbVie and Pfizer: A Closer Look at Two Pharma Heavyweights,ABBV's surging immunology sales and smoother LOE path stand out as both drugmakers face a pivotal 2026.,2025-11-26 15:42:00,Yahoo,https://finnhub.io/api/news?id=6ac81ded30baa5da034478881631ffce1a918e07dea7f3e46eead3cfc0a99ab1,LLY
Eli Lilly: $1 Trillion Built On One Drug Segment,Eli Lilly and Company is rated Sell due to extreme dependence on GLP-1 drugs & valuation that assumes near-perfect conditions. Read more on LLY stock here.,2025-11-26 15:43:25,SeekingAlpha,https://finnhub.io/api/news?id=b9d091b5669047849add1425356211798ae48e633f4597f557700da906989923,LLY
NVO Stock Up as Amycretin Shows Strong Weight Loss in Type 2 Diabetes,Novo Nordisk jumps after phase II data show amycretin offers significant weight loss and HbA1c level reductions in type 2 diabetes patients.,2025-11-26 15:45:00,Yahoo,https://finnhub.io/api/news?id=7422f7ebf24e12958fe290a02a04ecd3ed66d23588ed2de2710b3c019b0abfac,LLY
CURE: Analysts Strike A Cautious Tone Heading Into 2026,"Discover why the Direxion Healthcare Bull 3X ETF is outperforming in 2025. Learn about key risks, returns, and buy ratings.",2025-11-26 16:28:37,SeekingAlpha,https://finnhub.io/api/news?id=a5ef5754831c30f25c83c66be5e038c5194b41554790fb800b0ad9b7a81a6a4b,LLY
Lilly's Moment: AI-Powered Pipeline Positions Shares to Surge in 2026,Eli Lilly's stock is surging amid a flurry of AI deals. Our proprietary Zacks Rank system confirms the trend.,2025-11-26 16:34:00,Yahoo,https://finnhub.io/api/news?id=17fee0e918b3b6d0041c32c128613a1763c9af7e00c40d9e2bda6ffa0c7f9870,LLY
CMS Slashes Prices Of 15 Major Drugs - Here's Why Pharma Valuations Won't Suffer,Discover how new U.S. Medicare drug price cuts impact major pharma stocks like Novo Nordisk and why sector resilience supports a strong outlook. Click for more.,2025-11-26 16:58:56,SeekingAlpha,https://finnhub.io/api/news?id=1f6a4babd9bee8ff46ea9bfd57aa2d2c9e4fb232cd4ea10363ae33b37483d4b4,LLY
Hard for Eli Lilly to move significantly higher from here in the short-term: Kessef Capital's Yaffee,"Len Yaffee, Kessef Capital, join 'Fast Money' to talk Amgen's obesity drug, Eli Lilly's current stock action, and much more.",2025-11-26 18:03:21,CNBC,https://finnhub.io/api/news?id=303b5ffda98d091833cda4518ed68b709c9b7ee68ad5481c0cbe374568362820,LLY
Why Eli Lilly (LLY) Hit $1 Trillion as Obesity Drug Momentum Ignites Investor Optimism,"Eli Lilly recently became the first healthcare company to surpass a $1 trillion market capitalization, propelled by surging demand for its GLP-1-based diabetes and obesity drugs, Zepbound and Mounjaro, alongside significant pipeline developments and expanded Medicare and Medicaid coverage. This milestone reflects growing investor optimism about Eli Lilly's innovation pipeline, its manufacturing investments, and the potential for its upcoming oral obesity treatment to further transform the...",2025-11-26 22:08:51,Yahoo,https://finnhub.io/api/news?id=b244e7017947bfa828ca6be5a23ec797818294293a036905e9e23bf8e83c56ca,LLY
Thanksgiving: Top 10 Most Innovative BioPharma Drugs In Phase 3,Highlighting 10 innovative late-stage BioPharma drugs with the potential to reshape treatment paradigms and industry dynamics. Click here to read our picks.,2025-11-27 07:20:44,SeekingAlpha,https://finnhub.io/api/news?id=957425ce99f347f8ced0b3b60d44d11301701358932b1cbe7eb457febabbcede,LLY
Prediction: This Growth Stock Could Hit a $2 Trillion Valuation by 2031,It's not only tech companies that can get to that market valuation.,2025-11-27 12:18:00,Yahoo,https://finnhub.io/api/news?id=24e3435ec0c8e97ea7770b7c622cc5adaadc798272e09fd7d52ca913c9d7066d,LLY
Eli Lilly’s Stock Price Has Fattened Up Like a Thanksgiving Turkey. Time to (Options) Collar That Green!,"As Eli Lilly makes history by joining the $1 trillion club, here’s how you can position for its next move.",2025-11-27 12:30:02,Yahoo,https://finnhub.io/api/news?id=ea516e209e1d8e27e74db79a280b4cfc9007f8bf3bb2939a88c4818f85be9bce,LLY
Novo Nordisk Seeks Extra-Fast Nod From FDA for Higher Dose of Wegovy,NVO seeks an expedited FDA review for a higher 7.2 mg dose of Wegovy after strong weight-loss results in its STEP UP study.,2025-11-27 16:24:00,Yahoo,https://finnhub.io/api/news?id=a33491673345183c33592b13d6bb2c6642734382180936bbc3c25f84931862a5,LLY
Novo Nordisk or Pfizer: Which Healthcare Giant Is the Better Bet?,PFE's oncology gains and obesity re-entry contrast with NVO's GLP-1 pressures in this in-depth comparison of two healthcare giants.,2025-11-27 16:51:00,Yahoo,https://finnhub.io/api/news?id=2961f9d90368cc8e476d3dbafdda6ed6765fe87f8137b478b2dc847e4606d222,LLY
Zacks Investment Ideas feature highlights Lilly,Lilly have been highlighted in this Investment Ideas article.,2025-11-28 10:05:00,Yahoo,https://finnhub.io/api/news?id=76bf6599d4ecf1c142258b494aa9b20d13c950929933f0c76735806f02ee8206,LLY
"Healthcare, Eli Lilly see some profit taking but are the biggest winners this month","Healthcare, Eli Lilly see some profit taking but are the biggest winners this month",2025-11-28 10:53:47,MarketWatch,https://finnhub.io/api/news?id=7c467cbd21adc283732e2531a1c5a3b4fb7c1e778d93bdc0b12072a9bfc8f3fd,LLY
"Wall Street Eyes Fifth Day Of Gains, Silver Hits Record Highs At $55: What's Moving Markets Friday?","Stocks were rising again midday Friday, putting Wall Street on pace for a fifth straight day of gains as rate cut hopes surged and risk appetite returned across tech, crypto and commodities.",2025-11-28 13:29:50,Benzinga,https://finnhub.io/api/news?id=e7c77302012ddee441e9165591f185375999fe516f0b3eacdac8fc534206849d,LLY
Investors Heavily Search Eli Lilly and Company (LLY): Here is What You Need to Know,"Recently, Zacks.com users have been paying close attention to Lilly (LLY). This makes it worthwhile to examine what the stock has in store.",2025-11-28 14:00:06,Yahoo,https://finnhub.io/api/news?id=6106aa2f15a40c04fd094a49171830fecccc80326a7f990ff042b84c2aa576b1,LLY
A Conductor For The Orchestra: Seasoned Healthcare Executive Raises $52 Million For An AI Health Startup,"Michelle Carnahan has spent the better part of the last three decades working in healthcare at companies like Thirty Madison and Eli Lilly (NYSE:LLY). Now, the entrepreneur has raised $52 million in seed money for her own startup, Arbiter, a platform that connects health care professionals and payers to provide better patient care. The money has all been raised from family offices, including TriEdge Investments, MFO Ventures, and WindRose Health Investors, according to the company's funding anno",2025-11-28 14:16:07,Yahoo,https://finnhub.io/api/news?id=10675eee516507eb8a0fbf47df5e7f5a8f0787784a6bd2d35a63c67fc2078586,LLY
These Were the S&P 500’s Best and Worst Stocks in November,"Lithium miner Albemarle came out on top, while Super Micro Computer led the list of worst performers.",2025-11-28 16:21:00,Yahoo,https://finnhub.io/api/news?id=09116c69b26b5913a4d189635801262c7c2355ef5e332d814cbb8d3a89ff8923,LLY
Eli Lilly & Co. stock underperforms Friday when compared to competitors,Eli Lilly & Co. stock underperforms Friday when compared to competitors,2025-11-28 16:30:00,MarketWatch,https://finnhub.io/api/news?id=cdeab25bb94a683028494747bf00ecb62301167b65a0fb934954590869620d17,LLY
"Top Stock Movers Now: Intel Rises, Nvidia and Oracle Slip; Bitcoin Price Near $92,000",Shares of U.S. chipmaker Intel were leading the S&P higher as stocks edged upward on a holiday-shortened Black Friday session expected to be light on trading volume and corporate news.,2025-11-28 16:36:08,Yahoo,https://finnhub.io/api/news?id=7926359cc65669e58a8bcf8df8f157dc05f8dcbbf61ccd21b0759ade5b44a89d,LLY
S&P 500 Gains and Losses Today: Intel Soars Amid Apple Deal Rumors; Eli Lilly Stock Slides,"The possibility of adding a new Big Tech customer helped lift an American chipmaker's stock on Friday, Nov. 28, 2025, while a recently hot pharmaceutical stock cooled.",2025-11-28 18:42:21,Yahoo,https://finnhub.io/api/news?id=8ec79de440bebc4e54acd997a14665bea8b0ea1255dd91fa17702d8db8dab29c,LLY
Why Eli Lilly's 'market-cap explosion' might be 'misplaced',"Mizuho Americas healthcare equity strategist, Jared Holz, joins Market Catalysts host Julie Hyman to discuss Eli Lilly's (LLY) stock action, how the GLP-1 market has played a part, and whether Eli Lilly will see serious competition in the oral GLP-1 market moving forward. To watch more expert insights and analysis on the latest market action, check out more Market Catalysts.",2025-11-28 21:00:00,Yahoo,https://finnhub.io/api/news?id=fdd45edcc74786b68d5a29618da3f273edbae7738b4ae2392e10b27aaae7cf15,LLY
"Novo Nordisk: Headwinds On The Surface, Deep Value If You Dig",Novo Nordisk (NVO) remains a strong buy in the weight loss/diabetes market despite challenges. Read here for an investment analysis.,2025-11-28 22:32:14,SeekingAlpha,https://finnhub.io/api/news?id=71325fb78c30621d9d0cc429ff41f5d0ca436a790256fa5dcbf10576ab57273e,LLY
