headline,summary,datetime,source,url,ticker
Is the Subsea 7-Saipem Combination Too Powerful for Brazil?,SUBCY's planned merger with Saipem faces pushback as Brazil's oil giants warn it could reshape competition in deepwater projects.,2025-12-04 16:01:00,Yahoo,https://finnhub.io/api/news?id=1ca2c17240b5a01d1e36788c5fe7fe7be79cd329abbdf586188a954ee5b76177,XOM
EIA's Forecast for Alaska's Oil Boom to Power Energy ETFs,Alaska's projected 13% oil surge in 2026 fuels a powerful tailwind for energy ETFs heavily exposed to COP and XOM.,2025-12-04 15:58:00,Yahoo,https://finnhub.io/api/news?id=3d52bd313fc45219df03deba0a033e22dd22eb6525f981baf7b1df73bd866130,XOM
Sector Update: Energy Stocks Edge Higher Pre-Bell Thursday,"Energy stocks were edging higher pre-bell Thursday, with the Energy Select Sector SPDR Fund (XLE) ad",2025-12-04 14:26:06,Yahoo,https://finnhub.io/api/news?id=74bb2738fc2fa851bf9b04f7e37580f11f2856b83310fbed8a290a9f97fac061,XOM
Inside ExxonMobil's Balance Sheet: Key Takeaways for Investors,XOM's strong balance sheet and low debt load highlight its resilience amid volatile energy markets and support its long-term strategy.,2025-12-04 12:13:00,Yahoo,https://finnhub.io/api/news?id=d9ff5d31e4c8c011f68eb97e6c54ccd31f96ff091f027d9c76aa7480a442f1eb,XOM
ExxonMobil Prepares to Permanently Close Singapore Petrochemical Unit,"U.S. supermajor ExxonMobil plans to permanently shut down one of two steam crackers at its Singaporean refining and petrochemical complex, a move driven by global overcapacity and threatened profitability in the industry.",2025-12-04 11:00:00,Yahoo,https://finnhub.io/api/news?id=13bdeb13123199d39f7ce3de7b0e20824de382d4b083a8e2f2734b24b8447498,XOM
"‘Drill, Baby, Drill’: Europe Aims To Reduce Reliance on US LNG","Greece, Italy, and the UK are reopening offshore oil and gas exploration as domestic output becomes essential to curb reliance on costly LNG imports.",2025-12-03 21:00:00,Yahoo,https://finnhub.io/api/news?id=7f15ead98ba091a66ab2d872700d1e02bce8f63eb81135dced205550137aa5f3,XOM
The 2 Best High-Yield Energy Stocks in Vanguard High Dividend Yield ETF,"If you have a focus on high-yield stocks, the Vanguard High Dividend Yield ETF is a good place to fish for ideas.",2025-12-03 17:50:00,Yahoo,https://finnhub.io/api/news?id=e992b6d3b4705ff43f06b5e346bb208cf052f6afcd6bc919e16f34c267ae9c62,XOM
Exxon Mobil Corp. stock outperforms competitors on strong trading day,Exxon Mobil Corp. stock outperforms competitors on strong trading day,2025-12-03 16:31:00,MarketWatch,https://finnhub.io/api/news?id=034f5cf658ba383ba68ff5da6838e0cbcdfed390284d18f8e4efe90283f3912a,XOM
Chevron Lags Sector YTD - Can It Catch Up Before the Year-End?,"CVX trails the sector, but rising output, steadier crude prices and Hess-driven tailwinds could help it narrow the gap.",2025-12-03 13:54:00,Yahoo,https://finnhub.io/api/news?id=a648065f3946865821b54f0ac3db18a3d02a138c1b7a7213ba71196ddf61a187,XOM
Exxon Mobil (XOM): Evaluating Valuation After Its Steady Post-Pioneer Climb,"Why Exxon Mobil Is Back on Investors Radar Exxon Mobil (XOM) has quietly ground higher this year, and that steady climb is catching income and value investors attention as they weigh its cash generation against a still cautious energy backdrop. See our latest analysis for Exxon Mobil. At a share price of $115.38, Exxon Mobil has notched a solid year to date as investors warm to its steady cash flows, while a 5 year total shareholder return above 200 percent underlines that momentum, though...",2025-12-03 03:12:40,Yahoo,https://finnhub.io/api/news?id=dd20e341dda6a9da71a208c91977b8954e37a46dd064b812ab631a3918856f34,XOM
Sector Update: Energy Stocks Fall Late Afternoon,"Energy stocks were lower late Tuesday afternoon, with the NYSE Energy Sector Index decreasing 1% and",2025-12-02 21:07:03,Yahoo,https://finnhub.io/api/news?id=e0c06de8080bd63f0485298ffd1405f9c0bc210b21107ef594d83e63d200bd38,XOM
Sector Update: Energy Stocks Decline Tuesday Afternoon,"Energy stocks were lower Tuesday afternoon, with the NYSE Energy Sector Index decreasing 0.9% and th",2025-12-02 18:56:02,Yahoo,https://finnhub.io/api/news?id=1a1b2dc1321595da1879a92796cbf0d14fb0c31e692769e240368a41cd679d21,XOM
Exxon Mobil Corp. stock outperforms competitors despite losses on the day,Exxon Mobil Corp. stock outperforms competitors despite losses on the day,2025-12-02 16:31:00,MarketWatch,https://finnhub.io/api/news?id=559f22017ecb56bb8a4b26f543558f0773da7e8e312d8369ee9438a9b7d160c6,XOM
ExxonMobil in talks to acquire Lukoil’s stake in Iraqi oilfield,The West Qurna 2 oilfield is said to represent around 0.5% of global oil supply and 9% of total output in Iraq.,2025-12-02 15:15:09,Yahoo,https://finnhub.io/api/news?id=26d952f74ab1efb182db252d12068e53e6c6dddb9ea15151c28a38be5d7d420b,XOM
The Most Boring Oil Month in Years Sets the Stage for a High-Stakes December,"After a month where every geopolitical bet fizzled, the oil market enters December searching for its next catalyst.",2025-12-02 15:00:00,Yahoo,https://finnhub.io/api/news?id=d1764ac97a39aa31490165b1f89acc773faaed680a285c93243170158e988e50,XOM
Looking at the Narrative for Exxon Mobil After Analyst Upgrades and Industry Shifts,"Exxon Mobil's fair value estimate has been adjusted slightly upward, moving from $128.44 to $128.72, in response to nuanced revisions in the company's long-term outlook. This subtle price target shift reflects both steady operational strength and cautious industry sentiment, as analysts weigh recent performance against broader energy trends. Investors can follow these evolving projections and stay informed as the company's narrative develops. Analyst Price Targets don't always capture the...",2025-12-02 13:06:37,Yahoo,https://finnhub.io/api/news?id=938ff3c4768e2ade5b4931e43534ede24139980d3a4bd8d0897d3f6e873569dc,XOM
Exxon Eyes Lukoil’s Huge Iraqi Oilfield as U.S. Sanctions Forces Sales,"U.S. sanctions on Lukoil have triggered the sale of its international assets, including its 75% stake in Iraq's massive West Qurna 2 oilfield, which has drawn interest from buyers like ExxonMobil, Chevron, and Carlyle.",2025-12-02 12:00:00,Yahoo,https://finnhub.io/api/news?id=701080dacbc022b75cfaf1108f4bf9b98c376c539bef0256dbac582f9fd5236f,XOM
Market Chatter: Exxon Mobil Expresses Interest in Lukoil Stake in Iraq's West Qurna 2 Oilfield,Exxon Mobil (XOM) has approached Iraq's oil ministry to express interest in acquiring Lukoil's major,2025-12-02 09:10:48,Yahoo,https://finnhub.io/api/news?id=3fe0cf45f1cfc0ec7bcf59c532eb0cf5395cca66d6130d0a7d81e725b33833c6,XOM
"Exxon Has Approached Iraq to Buy Lukoil's Stake in Giant West Qurna 2 Oil Field, Sources Tell Reuters","Exxon Has Approached Iraq to Buy Lukoil's Stake in Giant West Qurna 2 Oil Field, Sources Tell Reuters",2025-12-02 06:24:00,MarketWatch,https://finnhub.io/api/news?id=e038f9513761e7131aebe083abaf641992b5f87cde868ebf53b9c32166164131,XOM
Sector Update: Energy Stocks Rise Late Afternoon,"Energy stocks were higher late Monday afternoon, with the NYSE Energy Sector Index up 0.7% and the E",2025-12-01 21:07:09,Yahoo,https://finnhub.io/api/news?id=f30f036f2c525a4b766f32f4bca30e7835bd12e1e952105dbb365fb1238e68c9,XOM
Sector Update: Energy,"Energy stocks were higher late Monday afternoon, with the NYSE Energy Sector Index up 0.7% and the E",2025-12-01 20:45:36,Yahoo,https://finnhub.io/api/news?id=a6c273ab52ca1ed83e164f2c6c59668bbf7fd9e8db723dd0f7a226417072d44d,XOM
Exxon and 15 More ‘Quality’ Stocks to Own for a Volatile Market,"The market has staged an impressive rebound, but is in for more volatility.  The overarching up-and-down dynamic starts with the fact that sellers have been coming in near the market’s highs to knock stock prices lower because investors and traders know that the more artificial-intelligence spending happens today, the greater the likelihood that the spending will collapse tomorrow.  The  Cboe  Volatility Index, which shows the magnitude of expected swings in stock prices, hit 18 early Monday, down from about 26 in mid November but above its low for the year of about 14.",2025-12-01 19:22:00,Yahoo,https://finnhub.io/api/news?id=4fc2e9a58060754fb4a5298fd03ae6e73611b6a37a90ab2e330d1e3e5699017a,XOM
"Calls of the Day: Wynn, Las Vegas Sands, Exxon, Raymond James and Goldman Sachs",The Investment Committee debate the latest Calls of the Day.,2025-12-01 13:11:50,CNBC,https://finnhub.io/api/news?id=46e559c77d6afa1e41205f4eb86c2a5d34419bec8be6f8c5d3bc530da02d5d88,XOM
XOM's Upstream Advantage: The Growth Story Investors Shouldn't Ignore,"ExxonMobil's record Permian and Guyana output, plus new Midland acreage, underscores its strengthening upstream growth story.",2025-12-01 12:15:00,Yahoo,https://finnhub.io/api/news?id=ccd911978043717aa62e0f3db6ea4850588526fbda016740923afe14735f014a,XOM
TotalEnergies Completes Bonga Exit,"TotalEnergies completed the sale of its 12.5 percent stake in Oil Mining Lease 118, which contains the producing Bonga field, to partners Shell and Eni for $510 million.",2025-12-01 09:30:00,Yahoo,https://finnhub.io/api/news?id=26e32eef026a3ae1bde956d5b546a3da4de540839245029e04fb3753e458373d,XOM
Exxon Mobil: Only Short-Term Players Will Say It's Not A Buy,"Exxon Mobil's strong Guyana presence, natural gas growth prospects, and sound fundamentals should justify my bullish outlook. See why XOM stock is a Buy.",2025-12-01 06:42:29,SeekingAlpha,https://finnhub.io/api/news?id=b1411cfdee0aae4a54d39788041db0349e51e324a8bc34b7000f36b282c3c579,XOM
Gunvor Eyes Investment in U.S. Oil and Gas,Gunvor is exploring U.S. oil and gas asset purchases—primarily in natural gas—to strengthen ties with the Trump administration and expand its American presence.,2025-12-01 06:30:00,Yahoo,https://finnhub.io/api/news?id=9691f476b9cd7a98343877c6c63c6b7f06de4ec64b8af7f6118d5b841864df52,XOM
3 High-Yielding Dividend Growth Stocks That Can Generate Passive Income for Your Portfolio for Years,"These stocks have been raising their dividend payments annually for well over a decade, and they pay more than twice the S&P 500 average.",2025-11-29 20:30:00,Yahoo,https://finnhub.io/api/news?id=1c49e14c49fc34ab7a0540805077158f81f2b4d0e0e46de603b3acb52ddfe1ea,XOM
"If You Invested $10K In Exxon Mobil Stock 10 Years Ago, How Much Would You Have Now?","Exxon Mobil Corp. (NYSE:XOM) is a global energy and chemical company that explores for, produces, and sells crude oil and natural gas. It is set to report its Q4 2025 earnings on Jan. 30. Wall Street analysts expect the company to post EPS of $1.67, ...",2025-11-29 13:01:43,Yahoo,https://finnhub.io/api/news?id=1fccce35c2631946739c6f5b8eb511bd42171c44800a444a55f49a72ec5aad1d,XOM
10 Best CEFs This Month: Average Yield Of 9.5% (November 2025),This month's top 10 closed-end funds (CEFs) offer an average yield of 9.5% and strong long-term performance across diverse asset classes. Read the full list here.,2025-11-29 08:15:00,SeekingAlpha,https://finnhub.io/api/news?id=3c5f2aecec878da266a480465f7e5de1438fc4efe0713a6ed83b04e82dfeced3,XOM
Best Dividend Aristocrats For December 2025,"The ProShares S&P 500 Dividend Aristocrats ETF (NOBL) has underperformed the SPDR S&P 500 ETF (SPY) year-to-date, but November shows a reversal.",2025-11-29 08:02:04,SeekingAlpha,https://finnhub.io/api/news?id=f9d8eba394946c6c89d2213b0aa1b8b6f97400c0b00dde97a6f4d363f7bab735,XOM
Will ExxonMobil's (XOM) Hydrogen Project Pause Reshape Its Clean Energy Strategy?,"Earlier this month, BASF and ExxonMobil announced a strategic collaboration to advance methane pyrolysis technology for producing low-emission hydrogen, with a joint development agreement and plans to build a demonstration plant. The decision, combined with news that ExxonMobil paused its Baytown hydrogen project due to weak demand and economic uncertainty, highlights challenges faced by traditional energy companies in scaling up clean energy initiatives. Next, we'll examine how the pause of...",2025-11-29 07:09:22,Yahoo,https://finnhub.io/api/news?id=324b146e7b812a9fc8fd8a61b7b1da25153dc9274cbd55fac09ec927e17220bc,XOM
How ExxonMobil Plans to Sustain Cash Flows Amid Softer Crude Prices,XOM leans on low-cost Guyana and Permian assets to keep earnings and cash flows resilient even during a softer crude price environment.,2025-11-28 19:15:00,Yahoo,https://finnhub.io/api/news?id=6cffad1f6ed956c899ed8749da93e941524b880dfc762144f53ad3ddfb5b033a,XOM
Exxon Mobil Corp. stock underperforms Friday when compared to competitors despite daily gains,Exxon Mobil Corp. stock underperforms Friday when compared to competitors despite daily gains,2025-11-28 16:31:00,MarketWatch,https://finnhub.io/api/news?id=963f2e92028d371fb0b3b98b897018ad6579a339867acc5aa91bbb9b4c9a7d49,XOM
"Oil Holds Gains, Natural Gas Rockets as OPEC+ Meeting Nears","As Russia-Ukraine peace talks drag on, dampening last week’s hopes that a swift resolution could be around the corner, ICE Brent has settled comfortably around $63 per barrel by the end of this week.",2025-11-28 16:00:00,Yahoo,https://finnhub.io/api/news?id=176ea92db72a422139e5a9467554de4d10c831ea1890e31e415299d921f3276b,XOM
Exxon Mobil Corporation (XOM) Is a Trending Stock: Facts to Know Before Betting on It,"Exxon (XOM) has received quite a bit of attention from Zacks.com users lately. Therefore, it is wise to be aware of the facts that can impact the stock's prospects.",2025-11-28 14:00:05,Yahoo,https://finnhub.io/api/news?id=184ce31e4337969047f549c5acc8b551a0b583c32c7577be14924482e12dca90,XOM
"North Atlantic France SAS successfully completes the acquisition of a controlling stake in Esso Société Anonyme Française SA and of 100% of ExxonMobil Chemical France SAS, two independent companies of the ExxonMobil group","Paris, FRANCE, Nov. 28, 2025 (GLOBE NEWSWIRE) -- North Atlantic France SAS successfully completes the acquisition of a controlling stake in Esso Société Anonyme Française SA and of 100% of ExxonMobil Chemical France SAS, two independent companies of the ExxonMobil group Successful completion of the acquisition by North Atlantic France SAS (“North Atlantic France”) of the 82.89% controlling interest of ExxonMobil France Holding SAS (“ExxonMobil”) in French listed company Esso Société Anonyme Fran",2025-11-28 11:05:00,Yahoo,https://finnhub.io/api/news?id=dbbf46a614f3c01baaf39b835fd06363a869c035033da76a0c4fee96ae80dc18,XOM
IXC: Understanding The Structure And Suitability Of This Global Energy ETF,"iShares Global Energy ETF offers global exposure to major energy producers, but 58.8% of assets are in U.S. companies. Learn more about IXC ETF here.",2025-11-28 09:19:27,SeekingAlpha,https://finnhub.io/api/news?id=9c5d3ddeca4ec6a1329d87b5ae95041262ae9e0e551eeae7b5a964872772bf84,XOM
